  1   0.000000 27.60.129.157 -> 74.125.236.20 TCP 55883 > https [FIN, ACK] Seq=1 Ack=1 Win=14220 Len=0 TSV=5881546 TSER=2063582947
  2   0.000738 27.60.129.157 -> 74.125.236.24 TCP 47432 > http [RST, ACK] Seq=1 Ack=1 Win=11584 Len=0 TSV=5881546 TSER=2063518244
  3   0.000964 27.60.129.157 -> 74.125.236.24 TCP 60466 > http [FIN, ACK] Seq=1 Ack=1 Win=22166 Len=0 TSV=5881546 TSER=2063654509
  4   0.262832 74.125.236.20 -> 27.60.129.157 TCP https > 55883 [FIN, ACK] Seq=1 Ack=2 Win=272 Len=0 TSV=2063798151 TSER=5881546
  5   0.263095 27.60.129.157 -> 74.125.236.20 TCP 55883 > https [ACK] Seq=2 Ack=2 Win=14220 Len=0 TSV=5881599 TSER=2063798151
  6   0.294693 74.125.236.24 -> 27.60.129.157 TCP http > 60466 [FIN, ACK] Seq=1 Ack=2 Win=524 Len=0 TSV=2063720922 TSER=5881546
  7   0.295100 27.60.129.157 -> 74.125.236.24 TCP 60466 > http [ACK] Seq=2 Ack=2 Win=22166 Len=0 TSV=5881605 TSER=2063720922
  8   9.344932 27.60.129.157 -> 202.79.210.121 TCP 35876 > http [SYN] Seq=0 Win=14600 Len=0 MSS=1460 SACK_PERM=1 TSV=5883415 TSER=0 WS=4
  9  11.781034 202.79.210.121 -> 27.60.129.157 TCP http > 35876 [SYN, ACK] Seq=0 Ack=1 Win=8192 Len=0 MSS=1380 WS=8 SACK_PERM=1 TSV=122869481 TSER=5883415
 10  11.781781 27.60.129.157 -> 202.79.210.121 TCP 35876 > http [ACK] Seq=1 Ack=1 Win=14608 Len=0 TSV=5883902 TSER=122869481
 11  11.784013 27.60.129.157 -> 202.79.210.121 HTTP GET /BurstingPipe/adServer.b [Packet size limited during capture]
 12  12.089486 202.79.210.121 -> 27.60.129.157 HTTP HTTP/1.1 200 OK [Packet size limited during capture]
 13  12.090264 27.60.129.157 -> 202.79.210.121 TCP 35876 > http [ACK] Seq=703 Ack=600 Win=15808 Len=0 TSV=5883964 TSER=122869505
 14  12.142211 27.60.129.157 -> 202.79.210.121 TCP 35876 > http [FIN, ACK] Seq=703 Ack=600 Win=15808 Len=0 TSV=5883974 TSER=122869505
 15  12.156792 27.60.129.157 -> 122.160.120.56 DNS Standard query A timesofindia.indiatimes.com
 16  12.243419 122.160.120.56 -> 27.60.129.157 DNS Standard query response[Packet size limited during capture]
 17  12.244311 27.60.129.157 -> 96.17.182.40 TCP 48427 > http [SYN] Seq=0 Win=14600 Len=0 MSS=1460 SACK_PERM=1 TSV=5883995 TSER=0 WS=4
 18  12.244799 27.60.129.157 -> 96.17.182.40 TCP 48428 > http [SYN] Seq=0 Win=14600 Len=0 MSS=1460 SACK_PERM=1 TSV=5883995 TSER=0 WS=4
 19  12.304547 202.79.210.121 -> 27.60.129.157 TCP http > 35876 [ACK] Seq=600 Ack=704 Win=65536 Len=0 TSV=122869534 TSER=5883974
 20  12.334830 96.17.182.40 -> 27.60.129.157 TCP http > 48427 [SYN, ACK] Seq=0 Ack=1 Win=14480 Len=0 MSS=1380 SACK_PERM=1 TSV=3579887394 TSER=5883995 WS=1
 21  12.335111 27.60.129.157 -> 96.17.182.40 TCP 48427 > http [ACK] Seq=1 Ack=1 Win=14608 Len=0 TSV=5884013 TSER=3579887394
 22  12.335195 96.17.182.40 -> 27.60.129.157 TCP http > 48428 [SYN, ACK] Seq=0 Ack=1 Win=14480 Len=0 MSS=1380 SACK_PERM=1 TSV=3579887394 TSER=5883995 WS=1
 23  12.335334 27.60.129.157 -> 96.17.182.40 TCP 48428 > http [ACK] Seq=1 Ack=1 Win=14608 Len=0 TSV=5884013 TSER=3579887394
 24  12.336548 27.60.129.157 -> 96.17.182.40 HTTP GET / HTTP/1.1 [Packet size limited during capture]
 25  12.336801 27.60.129.157 -> 96.17.182.40 HTTP Continuation or non-HTTP traffic[Packet size limited during capture]
 26  12.643885 96.17.182.40 -> 27.60.129.157 TCP http > 48427 [ACK] Seq=1 Ack=1369 Win=17376 Len=0 TSV=3579887654 TSER=5884013
 27  12.644132 96.17.182.40 -> 27.60.129.157 TCP http > 48427 [ACK] Seq=1 Ack=1546 Win=20112 Len=0 TSV=3579887693 TSER=5884013
 28  12.683684 96.17.182.40 -> 27.60.129.157 HTTP HTTP/1.1 200 OK [Packet size limited during capture]
 29  12.683993 27.60.129.157 -> 96.17.182.40 TCP 48427 > http [ACK] Seq=1546 Ack=1369 Win=17504 Len=0 TSV=5884083 TSER=3579887720
 30  12.703579 96.17.182.40 -> 27.60.129.157 HTTP Continuation or non-HTTP traffic[Packet size limited during capture]
 31  12.703850 27.60.129.157 -> 96.17.182.40 TCP 48427 > http [ACK] Seq=1546 Ack=2737 Win=20400 Len=0 TSV=5884087 TSER=3579887720
 32  12.723404 96.17.182.40 -> 27.60.129.157 HTTP Continuation or non-HTTP traffic[Packet size limited during capture]
 33  12.723572 27.60.129.157 -> 96.17.182.40 TCP 48427 > http [ACK] Seq=1546 Ack=4105 Win=23296 Len=0 TSV=5884091 TSER=3579887720
 34  12.743504 96.17.182.40 -> 27.60.129.157 HTTP Continuation or non-HTTP traffic[Packet size limited during capture]
 35  12.743700 27.60.129.157 -> 96.17.182.40 TCP 48427 > http [ACK] Seq=1546 Ack=5473 Win=26192 Len=0 TSV=5884095 TSER=3579887720
 36  12.803503 96.17.182.40 -> 27.60.129.157 HTTP Continuation or non-HTTP traffic[Packet size limited during capture]
 37  12.803739 27.60.129.157 -> 96.17.182.40 TCP 48427 > http [ACK] Seq=1546 Ack=6841 Win=29088 Len=0 TSV=5884107 TSER=3579887836
 38  12.823536 96.17.182.40 -> 27.60.129.157 HTTP Continuation or non-HTTP traffic[Packet size limited during capture]
 39  12.823742 27.60.129.157 -> 96.17.182.40 TCP 48427 > http [ACK] Seq=1546 Ack=8209 Win=31984 Len=0 TSV=5884111 TSER=3579887836
 40  12.843463 96.17.182.40 -> 27.60.129.157 HTTP Continuation or non-HTTP traffic[Packet size limited during capture]
 41  12.843670 27.60.129.157 -> 96.17.182.40 TCP 48427 > http [ACK] Seq=1546 Ack=9577 Win=34880 Len=0 TSV=5884115 TSER=3579887853
 42  12.863404 96.17.182.40 -> 27.60.129.157 HTTP Continuation or non-HTTP traffic[Packet size limited during capture]
 43  12.863551 27.60.129.157 -> 96.17.182.40 TCP 48427 > http [ACK] Seq=1546 Ack=10945 Win=37776 Len=0 TSV=5884119 TSER=3579887853
 44  12.883389 96.17.182.40 -> 27.60.129.157 HTTP Continuation or non-HTTP traffic[Packet size limited during capture]
 45  12.883519 27.60.129.157 -> 96.17.182.40 TCP 48427 > http [ACK] Seq=1546 Ack=12313 Win=40672 Len=0 TSV=5884123 TSER=3579887873
 46  12.913514 96.17.182.40 -> 27.60.129.157 HTTP Continuation or non-HTTP traffic[Packet size limited during capture]
 47  12.913656 27.60.129.157 -> 96.17.182.40 TCP 48427 > http [ACK] Seq=1546 Ack=13681 Win=43568 Len=0 TSV=5884129 TSER=3579887873
 48  12.935278 96.17.182.40 -> 27.60.129.157 HTTP Continuation or non-HTTP traffic[Packet size limited during capture]
 49  12.935643 27.60.129.157 -> 96.17.182.40 TCP 48427 > http [ACK] Seq=1546 Ack=15049 Win=46464 Len=0 TSV=5884133 TSER=3579887894
 50  12.954237 96.17.182.40 -> 27.60.129.157 HTTP Continuation or non-HTTP traffic[Packet size limited during capture]
 51  12.954789 27.60.129.157 -> 96.17.182.40 TCP 48427 > http [ACK] Seq=1546 Ack=16417 Win=49360 Len=0 TSV=5884137 TSER=3579887894
 52  12.974130 96.17.182.40 -> 27.60.129.157 HTTP Continuation or non-HTTP traffic[Packet size limited during capture]
 53  12.974285 27.60.129.157 -> 96.17.182.40 TCP 48427 > http [ACK] Seq=1546 Ack=17785 Win=52256 Len=0 TSV=5884141 TSER=3579887953
 54  13.003455 96.17.182.40 -> 27.60.129.157 HTTP Continuation or non-HTTP traffic[Packet size limited during capture]
 55  13.003651 27.60.129.157 -> 96.17.182.40 TCP 48427 > http [ACK] Seq=1546 Ack=19153 Win=55152 Len=0 TSV=5884147 TSER=3579887953
 56  13.023707 96.17.182.40 -> 27.60.129.157 HTTP Continuation or non-HTTP traffic[Packet size limited during capture]
 57  13.023915 27.60.129.157 -> 96.17.182.40 TCP 48427 > http [ACK] Seq=1546 Ack=20521 Win=58048 Len=0 TSV=5884151 TSER=3579887973
 58  13.043532 96.17.182.40 -> 27.60.129.157 HTTP Continuation or non-HTTP traffic[Packet size limited during capture]
 59  13.043809 27.60.129.157 -> 96.17.182.40 TCP 48427 > http [ACK] Seq=1546 Ack=21889 Win=60944 Len=0 TSV=5884155 TSER=3579887973
 60  13.063622 96.17.182.40 -> 27.60.129.157 HTTP Continuation or non-HTTP traffic[Packet size limited during capture]
 61  13.064028 27.60.129.157 -> 96.17.182.40 TCP 48427 > http [ACK] Seq=1546 Ack=23257 Win=63120 Len=0 TSV=5884159 TSER=3579887993
 62  13.083844 96.17.182.40 -> 27.60.129.157 HTTP Continuation or non-HTTP traffic[Packet size limited during capture]
 63  13.084177 27.60.129.157 -> 96.17.182.40 TCP 48427 > http [ACK] Seq=1546 Ack=24625 Win=61904 Len=0 TSV=5884163 TSER=3579887993
 64  13.095188 27.60.129.157 -> 122.160.120.56 DNS Standard query A cdn.optimizely.com
 65  13.097943 27.60.129.157 -> 96.17.182.40 HTTP GET /default_b2_glblnavcss_v [Packet size limited during capture]
 66  13.098410 27.60.129.157 -> 96.17.182.40 HTTP Continuation or non-HTTP traffic[Packet size limited during capture]
 67  13.123643 96.17.182.40 -> 27.60.129.157 HTTP Continuation or non-HTTP traffic[Packet size limited during capture]
 68  13.123947 27.60.129.157 -> 96.17.182.40 TCP 48427 > http [ACK] Seq=1546 Ack=25993 Win=64096 Len=0 TSV=5884171 TSER=3579888013
 69  13.133911 96.17.182.40 -> 27.60.129.157 HTTP Continuation or non-HTTP traffic[Packet size limited during capture]
 70  13.134166 27.60.129.157 -> 96.17.182.40 TCP 48427 > http [ACK] Seq=1546 Ack=27361 Win=64096 Len=0 TSV=5884173 TSER=3579888013
 71  13.152984 96.17.182.40 -> 27.60.129.157 HTTP Continuation or non-HTTP traffic[Packet size limited during capture]
 72  13.153118 27.60.129.157 -> 96.17.182.40 TCP 48427 > http [ACK] Seq=1546 Ack=28729 Win=64096 Len=0 TSV=5884177 TSER=3579888033
 73  13.163543 96.17.182.40 -> 27.60.129.157 HTTP Continuation or non-HTTP traffic[Packet size limited during capture]
 74  13.173400 96.17.182.40 -> 27.60.129.157 HTTP Continuation or non-HTTP traffic[Packet size limited during capture]
 75  13.173578 27.60.129.157 -> 96.17.182.40 TCP 48427 > http [ACK] Seq=1546 Ack=31465 Win=64096 Len=0 TSV=5884181 TSER=3579888033
 76  13.183410 96.17.182.40 -> 27.60.129.157 HTTP Continuation or non-HTTP traffic[Packet size limited during capture]
 77  13.193509 96.17.182.40 -> 27.60.129.157 HTTP Continuation or non-HTTP traffic[Packet size limited during capture]
 78  13.193697 27.60.129.157 -> 96.17.182.40 TCP 48427 > http [ACK] Seq=1546 Ack=34201 Win=64096 Len=0 TSV=5884185 TSER=3579888055
 79  13.213513 96.17.182.40 -> 27.60.129.157 HTTP Continuation or non-HTTP traffic[Packet size limited during capture]
 80  13.223384 96.17.182.40 -> 27.60.129.157 HTTP Continuation or non-HTTP traffic[Packet size limited during capture]
 81  13.223522 27.60.129.157 -> 96.17.182.40 TCP 48427 > http [ACK] Seq=1546 Ack=36937 Win=64096 Len=0 TSV=5884191 TSER=3579888074
 82  13.235658 96.17.182.40 -> 27.60.129.157 HTTP Continuation or non-HTTP traffic[Packet size limited during capture]
 83  13.235873 96.17.182.40 -> 27.60.129.157 HTTP Continuation or non-HTTP traffic[Packet size limited during capture]
 84  13.253964 96.17.182.40 -> 27.60.129.157 HTTP Continuation or non-HTTP traffic[Packet size limited during capture]
 85  13.254117 96.17.182.40 -> 27.60.129.157 HTTP Continuation or non-HTTP traffic[Packet size limited during capture]
 86  13.254155 122.160.120.56 -> 27.60.129.157 DNS Standard query response CNAME[Packet size limited during capture]
 87  13.259134 27.60.129.157 -> 23.35.20.211 TCP 54789 > http [SYN] Seq=0 Win=14600 Len=0 MSS=1460 SACK_PERM=1 TSV=5884198 TSER=0 WS=4
 88  13.261483 27.60.129.157 -> 96.17.182.40 TCP 48427 > http [ACK] Seq=1546 Ack=41360 Win=64096 Len=0 TSV=5884198 TSER=3579888093
 89  13.268899 27.60.129.157 -> 96.17.182.40 HTTP GET /timestrendstopcommoncss [Packet size limited during capture]
 90  13.269076 27.60.129.157 -> 96.17.182.40 HTTP Continuation or non-HTTP traffic[Packet size limited during capture]
 91  13.288105 27.60.129.157 -> 223.165.31.12 TCP 51568 > http [SYN] Seq=0 Win=14600 Len=0 MSS=1460 SACK_PERM=1 TSV=5884204 TSER=0 WS=4
 92  13.288521 27.60.129.157 -> 223.165.31.19 TCP 35048 > http [SYN] Seq=0 Win=14600 Len=0 MSS=1460 SACK_PERM=1 TSV=5884204 TSER=0 WS=4
 93  13.288897 27.60.129.157 -> 223.165.31.15 TCP 57592 > http [SYN] Seq=0 Win=14600 Len=0 MSS=1460 SACK_PERM=1 TSV=5884204 TSER=0 WS=4
 94  13.347064 27.60.129.157 -> 23.35.20.211 TCP 54793 > http [SYN] Seq=0 Win=14600 Len=0 MSS=1460 SACK_PERM=1 TSV=5884215 TSER=0 WS=4
 95  13.354632 96.17.182.40 -> 27.60.129.157 TCP http > 48428 [ACK] Seq=1 Ack=1369 Win=17376 Len=0 TSV=3579888413 TSER=5884166
 96  13.394651 96.17.182.40 -> 27.60.129.157 TCP http > 48428 [ACK] Seq=1 Ack=1592 Win=20112 Len=0 TSV=3579888453 TSER=5884166
 97  13.403272 96.17.182.40 -> 27.60.129.157 HTTP HTTP/1.1 304 Not Modified [Packet size limited during capture]
 98  13.403398 27.60.129.157 -> 96.17.182.40 TCP 48428 > http [ACK] Seq=1592 Ack=243 Win=15680 Len=0 TSV=5884227 TSER=3579888456
 99  13.494705 23.35.20.211 -> 27.60.129.157 TCP http > 54789 [SYN, ACK] Seq=0 Ack=1 Win=14480 Len=0 MSS=1380 SACK_PERM=1 TSV=3105878041 TSER=5884198 WS=1
100  13.494861 27.60.129.157 -> 23.35.20.211 TCP 54789 > http [ACK] Seq=1 Ack=1 Win=14608 Len=0 TSV=5884245 TSER=3105878041
101  13.495272 27.60.129.157 -> 23.35.20.211 HTTP GET /js/83181943.js HTTP/1.1 [Packet size limited during capture]
102  13.534140 27.60.129.157 -> 223.165.31.15 TCP 57594 > http [SYN] Seq=0 Win=14600 Len=0 MSS=1460 SACK_PERM=1 TSV=5884253 TSER=0 WS=4
103  13.534494 27.60.129.157 -> 223.165.31.12 TCP 51573 > http [SYN] Seq=0 Win=14600 Len=0 MSS=1460 SACK_PERM=1 TSV=5884253 TSER=0 WS=4
104  13.534741 27.60.129.157 -> 223.165.31.19 TCP 35053 > http [SYN] Seq=0 Win=14600 Len=0 MSS=1460 SACK_PERM=1 TSV=5884253 TSER=0 WS=4
105  13.676671 96.17.182.40 -> 27.60.129.157 TCP http > 48427 [ACK] Seq=41360 Ack=3140 Win=25744 Len=0 TSV=3579888734 TSER=5884200
106  13.683401 96.17.182.40 -> 27.60.129.157 HTTP [TCP Retransmission] HTTP/1.1 304 Not Modified [Packet size limited during capture]
107  13.683524 27.60.129.157 -> 96.17.182.40 TCP [TCP Dup ACK 98#1] 48428 > http [ACK] Seq=1592 Ack=243 Win=15680 Len=0 TSV=5884283 TSER=3579888736 SLE=1 SRE=243
108  13.683564 96.17.182.40 -> 27.60.129.157 HTTP HTTP/1.1 304 Not Modified [Packet size limited during capture]
109  13.722441 27.60.129.157 -> 96.17.182.40 TCP 48427 > http [ACK] Seq=3140 Ack=41602 Win=64096 Len=0 TSV=5884291 TSER=3579888737
110  13.738648 223.165.31.12 -> 27.60.129.157 TCP http > 51568 [SYN, ACK] Seq=0 Ack=1 Win=16384 Len=0 MSS=1380 WS=0 TSV=0 TSER=0 SACK_PERM=1
111  13.738826 27.60.129.157 -> 223.165.31.12 TCP 51568 > http [ACK] Seq=1 Ack=1 Win=14608 Len=0 TSV=5884294 TSER=0
112  13.738863 223.165.31.19 -> 27.60.129.157 TCP http > 35048 [SYN, ACK] Seq=0 Ack=1 Win=16384 Len=0 MSS=1380 WS=0 TSV=0 TSER=0 SACK_PERM=1
113  13.738932 27.60.129.157 -> 223.165.31.19 TCP 35048 > http [ACK] Seq=1 Ack=1 Win=14608 Len=0 TSV=5884294 TSER=0
114  13.739516 27.60.129.157 -> 223.165.31.12 HTTP GET /ads.dll/getjsonad?sloti [Packet size limited during capture]
115  13.740226 27.60.129.157 -> 223.165.31.19 HTTP GET /ads.dll/getjsonad?sloti [Packet size limited during capture]
116  13.754494 23.35.20.211 -> 27.60.129.157 TCP http > 54793 [SYN, ACK] Seq=0 Ack=1 Win=14480 Len=0 MSS=1380 SACK_PERM=1 TSV=3568960365 TSER=5884215 WS=1
117  13.754661 27.60.129.157 -> 23.35.20.211 TCP 54793 > http [ACK] Seq=1 Ack=1 Win=14608 Len=0 TSV=5884297 TSER=3568960365
118  13.764481 223.165.31.15 -> 27.60.129.157 TCP http > 57592 [SYN, ACK] Seq=0 Ack=1 Win=16384 Len=0 MSS=1380 WS=0 TSV=0 TSER=0 SACK_PERM=1
119  13.764608 27.60.129.157 -> 223.165.31.15 TCP 57592 > http [ACK] Seq=1 Ack=1 Win=14608 Len=0 TSV=5884299 TSER=0
120  13.765167 27.60.129.157 -> 223.165.31.15 HTTP GET /ads.dll/genptypead?slot [Packet size limited during capture]
121  13.832719 23.35.20.211 -> 27.60.129.157 TCP http > 54789 [ACK] Seq=1 Ack=437 Win=15552 Len=0 TSV=3105878381 TSER=5884245
122  13.843241 23.35.20.211 -> 27.60.129.157 HTTP HTTP/1.1 304 Not Modified [Packet size limited during capture]
123  13.843320 27.60.129.157 -> 23.35.20.211 TCP 54789 > http [ACK] Seq=437 Ack=214 Win=15680 Len=0 TSV=5884315 TSER=3105878382
124  13.846494 223.165.31.15 -> 27.60.129.157 TCP http > 57594 [SYN, ACK] Seq=0 Ack=1 Win=16384 Len=0 MSS=1380 WS=0 TSV=0 TSER=0 SACK_PERM=1
125  13.846636 27.60.129.157 -> 223.165.31.15 TCP 57594 > http [ACK] Seq=1 Ack=1 Win=14608 Len=0 TSV=5884315 TSER=0
126  13.858617 223.165.31.19 -> 27.60.129.157 TCP http > 35053 [SYN, ACK] Seq=0 Ack=1 Win=16384 Len=0 MSS=1380 WS=0 TSV=0 TSER=0 SACK_PERM=1
127  13.858797 27.60.129.157 -> 223.165.31.19 TCP 35053 > http [ACK] Seq=1 Ack=1 Win=14608 Len=0 TSV=5884318 TSER=0
128  13.858827 223.165.31.12 -> 27.60.129.157 TCP http > 51573 [SYN, ACK] Seq=0 Ack=1 Win=16384 Len=0 MSS=1380 WS=0 TSV=0 TSER=0 SACK_PERM=1
129  13.858877 27.60.129.157 -> 223.165.31.12 TCP 51573 > http [ACK] Seq=1 Ack=1 Win=14608 Len=0 TSV=5884318 TSER=0
130  14.076702 27.60.129.157 -> 122.160.120.56 DNS Standard query A log3.optimizely.com
131  14.124422 27.60.129.157 -> 223.165.25.37 TCP 46978 > http [SYN] Seq=0 Win=14600 Len=0 MSS=1460 SACK_PERM=1 TSV=5884371 TSER=0 WS=4
132  14.127550 27.60.129.157 -> 223.165.25.37 TCP 46979 > http [SYN] Seq=0 Win=14600 Len=0 MSS=1460 SACK_PERM=1 TSV=5884372 TSER=0 WS=4
133  14.138429 223.165.31.12 -> 27.60.129.157 HTTP HTTP/1.1 200 OK [Packet size limited during capture]
134  14.138680 27.60.129.157 -> 223.165.31.12 TCP 51568 > http [ACK] Seq=1206 Ack=321 Win=15680 Len=0 TSV=5884374 TSER=346615659
135  14.138724 223.165.31.12 -> 27.60.129.157 HTTP Continuation or non-HTTP traffic[Packet size limited during capture]
136  14.138774 27.60.129.157 -> 223.165.31.12 TCP 51568 > http [ACK] Seq=1206 Ack=537 Win=16752 Len=0 TSV=5884374 TSER=346615659
137  14.223517 223.165.31.19 -> 27.60.129.157 HTTP HTTP/1.1 200 OK [Packet size limited during capture]
138  14.223772 27.60.129.157 -> 223.165.31.19 TCP 35048 > http [ACK] Seq=1206 Ack=322 Win=15680 Len=0 TSV=5884391 TSER=141335014
139  14.223822 223.165.31.19 -> 27.60.129.157 HTTP Continuation or non-HTTP traffic[Packet size limited during capture]
140  14.223897 27.60.129.157 -> 223.165.31.19 TCP 35048 > http [ACK] Seq=1206 Ack=469 Win=16752 Len=0 TSV=5884391 TSER=141335014
141  14.284606 27.60.129.157 -> 122.160.120.56 DNS Standard query A www.google-analytics.com
142  14.294156 27.60.129.157 -> 122.160.120.56 DNS Standard query A b.scorecardresearch.com
143  14.333741 23.35.20.211 -> 27.60.129.157 HTTP [TCP Retransmission] HTTP/1.1 304 Not Modified [Packet size limited during capture]
144  14.333895 27.60.129.157 -> 23.35.20.211 TCP [TCP Dup ACK 123#1] 54789 > http [ACK] Seq=437 Ack=214 Win=15680 Len=0 TSV=5884413 TSER=3105878871 SLE=1 SRE=214
145  14.374386 27.60.129.157 -> 223.165.25.37 TCP 46980 > http [SYN] Seq=0 Win=14600 Len=0 MSS=1460 SACK_PERM=1 TSV=5884421 TSER=0 WS=4
146  14.376968 27.60.129.157 -> 223.165.25.37 TCP 46981 > http [SYN] Seq=0 Win=14600 Len=0 MSS=1460 SACK_PERM=1 TSV=5884421 TSER=0 WS=4
147  14.413803 223.165.31.15 -> 27.60.129.157 HTTP HTTP/1.1 200 OK [Packet size limited during capture]
148  14.414143 27.60.129.157 -> 223.165.31.15 TCP 57592 > http [ACK] Seq=1171 Ack=226 Win=15680 Len=0 TSV=5884429 TSER=22601293
149  14.414204 223.165.31.15 -> 27.60.129.157 TCP http > 57592 [FIN, ACK] Seq=226 Ack=1171 Win=64365 Len=0 TSV=22601293 TSER=5884299
150  14.415396 27.60.129.157 -> 223.165.31.15 TCP 57592 > http [FIN, ACK] Seq=1171 Ack=227 Win=15680 Len=0 TSV=5884429 TSER=22601293
151  14.416895 223.165.25.37 -> 27.60.129.157 TCP http > 46979 [SYN, ACK] Seq=0 Ack=1 Win=64240 Len=0 MSS=1380 WS=0 TSV=0 TSER=0 SACK_PERM=1
152  14.417214 27.60.129.157 -> 223.165.25.37 TCP 46979 > http [ACK] Seq=1 Ack=1 Win=14608 Len=0 TSV=5884429 TSER=0
153  14.417298 223.165.25.37 -> 27.60.129.157 TCP http > 46978 [SYN, ACK] Seq=0 Ack=1 Win=64240 Len=0 MSS=1380 WS=0 TSV=0 TSER=0 SACK_PERM=1
154  14.417487 27.60.129.157 -> 223.165.25.37 TCP 46978 > http [ACK] Seq=1 Ack=1 Win=14608 Len=0 TSV=5884430 TSER=0
155  14.418911 27.60.129.157 -> 223.165.25.37 HTTP GET /cmslog.dll?cms-msid=471 [Packet size limited during capture]
156  14.419283 27.60.129.157 -> 223.165.25.37 HTTP Continuation or non-HTTP traffic[Packet size limited during capture]
157  14.420128 27.60.129.157 -> 223.165.25.37 HTTP GET /timeslog.dll/topcnt?CHU [Packet size limited during capture]
158  14.420387 27.60.129.157 -> 223.165.25.37 HTTP Continuation or non-HTTP traffic[Packet size limited during capture]
159  14.443601 122.160.120.56 -> 27.60.129.157 DNS Standard query response[Packet size limited during capture]
160  14.445566 27.60.129.157 -> 74.125.236.4 TCP 54119 > http [SYN] Seq=0 Win=14600 Len=0 MSS=1460 SACK_PERM=1 TSV=5884435 TSER=0 WS=4
161  14.463313 122.160.120.56 -> 27.60.129.157 DNS Standard query response[Packet size limited during capture]
162  14.464924 27.60.129.157 -> 96.17.182.58 TCP 55080 > http [SYN] Seq=0 Win=14600 Len=0 MSS=1460 SACK_PERM=1 TSV=5884439 TSER=0 WS=4
163  14.476691 223.165.25.37 -> 27.60.129.157 TCP http > 46980 [SYN, ACK] Seq=0 Ack=1 Win=64240 Len=0 MSS=1380 WS=0 TSV=0 TSER=0 SACK_PERM=1
164  14.476967 27.60.129.157 -> 223.165.25.37 TCP 46980 > http [ACK] Seq=1 Ack=1 Win=14608 Len=0 TSV=5884441 TSER=0
165  14.493601 27.60.129.157 -> 74.125.236.25 TCP 41486 > http [SYN] Seq=0 Win=14600 Len=0 MSS=1460 SACK_PERM=1 TSV=5884445 TSER=0 WS=4
166  14.496794 223.165.25.37 -> 27.60.129.157 TCP http > 46981 [SYN, ACK] Seq=0 Ack=1 Win=64240 Len=0 MSS=1380 WS=0 TSV=0 TSER=0 SACK_PERM=1
167  14.497209 27.60.129.157 -> 223.165.25.37 TCP 46981 > http [ACK] Seq=1 Ack=1 Win=14608 Len=0 TSV=5884445 TSER=0
168  14.535287 27.60.129.157 -> 74.125.236.4 TCP 54122 > http [SYN] Seq=0 Win=14600 Len=0 MSS=1460 SACK_PERM=1 TSV=5884453 TSER=0 WS=4
169  14.544039 27.60.129.157 -> 96.17.182.58 TCP 55083 > http [SYN] Seq=0 Win=14600 Len=0 MSS=1460 SACK_PERM=1 TSV=5884455 TSER=0 WS=4
170  14.546598 223.165.31.15 -> 27.60.129.157 TCP http > 57592 [ACK] Seq=227 Ack=1172 Win=64365 Len=0 TSV=22601294 TSER=5884429
171  14.623255 122.160.120.56 -> 27.60.129.157 DNS Standard query response CNAME[Packet size limited during capture]
172  14.624225 27.60.129.157 -> 54.243.181.116 TCP 42069 > http [SYN] Seq=0 Win=14600 Len=0 MSS=1460 SACK_PERM=1 TSV=5884471 TSER=0 WS=4
173  14.743679 223.165.25.37 -> 27.60.129.157 TCP http > 46979 [ACK] Seq=1 Ack=1434 Win=64240 Len=0 TSV=216359800 TSER=5884372
174  14.743824 223.165.25.37 -> 27.60.129.157 HTTP HTTP/1.1 200 OK [Packet size limited during capture]
175  14.743886 27.60.129.157 -> 223.165.25.37 TCP 46979 > http [ACK] Seq=1434 Ack=192 Win=15680 Len=0 TSV=5884495 TSER=216359800
176  14.743921 223.165.25.37 -> 27.60.129.157 HTTP Continuation or non-HTTP traffic[Packet size limited during capture]
177  14.743966 27.60.129.157 -> 223.165.25.37 TCP 46979 > http [ACK] Seq=1434 Ack=235 Win=15680 Len=0 TSV=5884495 TSER=216359800
178  14.747032 27.60.129.157 -> 74.125.236.25 TCP 41490 > http [SYN] Seq=0 Win=14600 Len=0 MSS=1460 SACK_PERM=1 TSV=5884495 TSER=0 WS=1
179  15.043504 96.17.182.58 -> 27.60.129.157 TCP http > 55080 [SYN, ACK] Seq=0 Ack=1 Win=14480 Len=0 MSS=1380 SACK_PERM=1 TSV=3566929560 TSER=5884439 WS=1
180  15.043922 27.60.129.157 -> 96.17.182.58 TCP 55080 > http [ACK] Seq=1 Ack=1 Win=14608 Len=0 TSV=5884555 TSER=3566929560
181  15.043964 96.17.182.58 -> 27.60.129.157 TCP http > 55083 [SYN, ACK] Seq=0 Ack=1 Win=14480 Len=0 MSS=1380 SACK_PERM=1 TSV=3566929571 TSER=5884455 WS=1
182  15.044047 27.60.129.157 -> 96.17.182.58 TCP 55083 > http [ACK] Seq=1 Ack=1 Win=14608 Len=0 TSV=5884555 TSER=3566929571
183  15.044075 223.165.25.37 -> 27.60.129.157 TCP http > 46978 [ACK] Seq=1 Ack=1524 Win=64240 Len=0 TSV=216359803 TSER=5884430
184  15.044156 223.165.25.37 -> 27.60.129.157 HTTP HTTP/1.1 200 OK [Packet size limited during capture]
185  15.044212 27.60.129.157 -> 223.165.25.37 TCP 46978 > http [ACK] Seq=1524 Ack=680 Win=15968 Len=0 TSV=5884555 TSER=216359803
186  15.044240 223.165.25.37 -> 27.60.129.157 HTTP Continuation or non-HTTP traffic[Packet size limited during capture]
187  15.044292 27.60.129.157 -> 223.165.25.37 TCP 46978 > http [ACK] Seq=1524 Ack=723 Win=15968 Len=0 TSV=5884555 TSER=216359803
188  15.044685 27.60.129.157 -> 96.17.182.58 HTTP GET /b?c1=2&c2=6036484&ns__t [Packet size limited during capture]
189  15.070747 74.125.236.4 -> 27.60.129.157 TCP http > 54119 [SYN, ACK] Seq=0 Ack=1 Win=14180 Len=0 MSS=1380 SACK_PERM=1 TSV=2063732610 TSER=5884435 WS=6
190  15.070923 27.60.129.157 -> 74.125.236.4 TCP 54119 > http [ACK] Seq=1 Ack=1 Win=14608 Len=0 TSV=5884560 TSER=2063732610
191  15.070966 74.125.236.25 -> 27.60.129.157 TCP http > 41486 [SYN, ACK] Seq=0 Ack=1 Win=14180 Len=0 MSS=1380 SACK_PERM=1 TSV=2063806923 TSER=5884445 WS=6
192  15.071045 27.60.129.157 -> 74.125.236.25 TCP 41486 > http [ACK] Seq=1 Ack=1 Win=14608 Len=0 TSV=5884560 TSER=2063806923
193  15.071468 27.60.129.157 -> 74.125.236.4 HTTP GET /__utm.gif?utmwv=5.3.8&u [Packet size limited during capture]
194  15.071965 27.60.129.157 -> 74.125.236.25 HTTP GET /gampad/ads?gdfp_req=1&c [Packet size limited during capture]
195  15.072103 27.60.129.157 -> 74.125.236.25 HTTP Continuation or non-HTTP traffic[Packet size limited during capture]
196  15.080491 74.125.236.4 -> 27.60.129.157 TCP http > 54122 [SYN, ACK] Seq=0 Ack=1 Win=14180 Len=0 MSS=1380 SACK_PERM=1 TSV=2063732622 TSER=5884453 WS=6
197  15.080637 27.60.129.157 -> 74.125.236.4 TCP 54122 > http [ACK] Seq=1 Ack=1 Win=14608 Len=0 TSV=5884562 TSER=2063732622
198  15.086575 74.125.236.25 -> 27.60.129.157 TCP http > 41490 [SYN, ACK] Seq=0 Ack=1 Win=14180 Len=0 MSS=1380 SACK_PERM=1 TSV=2063806953 TSER=5884495 WS=6
199  15.086684 27.60.129.157 -> 74.125.236.25 TCP 41490 > http [ACK] Seq=1 Ack=1 Win=14600 Len=0 TSV=5884563 TSER=2063806953
200  15.254660 96.17.182.58 -> 27.60.129.157 TCP http > 55080 [ACK] Seq=1 Ack=671 Win=15820 Len=0 TSV=3566929830 TSER=5884555
201  15.263289 96.17.182.58 -> 27.60.129.157 HTTP HTTP/1.1 204 No Content [Packet size limited during capture]
202  15.263426 27.60.129.157 -> 96.17.182.58 TCP 55080 > http [ACK] Seq=671 Ack=249 Win=15680 Len=0 TSV=5884599 TSER=3566929831
203  15.300686 54.243.181.116 -> 27.60.129.157 TCP http > 42069 [SYN, ACK] Seq=0 Ack=1 Win=5792 Len=0 MSS=1380 SACK_PERM=1 TSV=728517508 TSER=5884471 WS=8
204  15.300930 27.60.129.157 -> 54.243.181.116 TCP 42069 > http [ACK] Seq=1 Ack=1 Win=14608 Len=0 TSV=5884606 TSER=728517508
205  15.301699 27.60.129.157 -> 54.243.181.116 HTTP GET /event?a=83181943&d=8318 [Packet size limited during capture]
206  15.405738 27.60.129.157 -> 96.17.182.40 TCP 48428 > http [FIN, ACK] Seq=1592 Ack=243 Win=15680 Len=0 TSV=5884627 TSER=3579888736
207  15.473831 74.125.236.4 -> 27.60.129.157 TCP http > 54119 [ACK] Seq=1 Ack=926 Win=16064 Len=0 TSV=2063733022 TSER=5884560
208  15.474102 74.125.236.4 -> 27.60.129.157 HTTP HTTP/1.1 200 OK [Packet size limited during capture]
209  15.474219 27.60.129.157 -> 74.125.236.4 TCP 54119 > http [ACK] Seq=926 Ack=377 Win=15680 Len=0 TSV=5884641 TSER=2063733023
210  15.794077 74.125.236.25 -> 27.60.129.157 TCP http > 41490 [SYN, ACK] Seq=0 Ack=1 Win=14180 Len=0 MSS=1380 SACK_PERM=1 TSV=2063807358 TSER=5884495 WS=6
211  15.794437 27.60.129.157 -> 74.125.236.25 TCP [TCP Dup ACK 199#1] 41490 > http [ACK] Seq=1 Ack=1 Win=14600 Len=0 TSV=5884705 TSER=2063807358 SLE=0 SRE=1
212  15.794643 74.125.236.4 -> 27.60.129.157 TCP http > 54122 [SYN, ACK] Seq=0 Ack=1 Win=14180 Len=0 MSS=1380 SACK_PERM=1 TSV=2063733080 TSER=5884453 WS=6
213  15.794772 27.60.129.157 -> 74.125.236.4 TCP [TCP Dup ACK 197#1] 54122 > http [ACK] Seq=1 Ack=1 Win=14608 Len=0 TSV=5884705 TSER=2063733080 SLE=0 SRE=1
214  15.794806 96.17.182.58 -> 27.60.129.157 HTTP [TCP Retransmission] HTTP/1.1 204 No Content [Packet size limited during capture]
215  15.794913 27.60.129.157 -> 96.17.182.58 TCP [TCP Dup ACK 202#1] 55080 > http [ACK] Seq=671 Ack=249 Win=15680 Len=0 TSV=5884705 TSER=3566930318 SLE=1 SRE=249
216  15.794939 96.17.182.40 -> 27.60.129.157 TCP http > 48428 [FIN, ACK] Seq=243 Ack=1593 Win=20112 Len=0 TSV=3579890850 TSER=5884627
217  15.795067 27.60.129.157 -> 96.17.182.40 TCP 48428 > http [ACK] Seq=1593 Ack=244 Win=15680 Len=0 TSV=5884705 TSER=3579890850
218  15.883410 74.125.236.25 -> 27.60.129.157 TCP [TCP Window Update] http > 41486 [ACK] Seq=1 Ack=1 Win=14208 Len=0 TSV=2063807729 TSER=5884560 SLE=1369 SRE=2009
219  15.883578 74.125.236.25 -> 27.60.129.157 TCP http > 41486 [ACK] Seq=1 Ack=2009 Win=16960 Len=0 TSV=2063807729 TSER=5884560
220  16.214181 74.125.236.25 -> 27.60.129.157 HTTP HTTP/1.1 200 OK [Packet size limited during capture]
221  16.214831 27.60.129.157 -> 74.125.236.25 TCP 41486 > http [ACK] Seq=2009 Ack=1369 Win=17504 Len=0 TSV=5884789 TSER=2063807914
222  16.215527 74.125.236.25 -> 27.60.129.157 HTTP Continuation or non-HTTP traffic[Packet size limited during capture]
223  16.215740 27.60.129.157 -> 74.125.236.25 TCP 41486 > http [ACK] Seq=2009 Ack=2737 Win=20400 Len=0 TSV=5884789 TSER=2063807914
224  16.215855 74.125.236.25 -> 27.60.129.157 HTTP Continuation or non-HTTP traffic[Packet size limited during capture]
225  16.216040 27.60.129.157 -> 74.125.236.25 TCP 41486 > http [ACK] Seq=2009 Ack=3049 Win=23136 Len=0 TSV=5884789 TSER=2063807914
226  16.216149 54.243.181.116 -> 27.60.129.157 TCP http > 42069 [ACK] Seq=1 Ack=646 Win=5632 Len=0 TSV=728518017 TSER=5884606
227  16.216341 54.243.181.116 -> 27.60.129.157 HTTP HTTP/1.1 200 OK [Packet size limited during capture]
228  16.216500 27.60.129.157 -> 54.243.181.116 TCP 42069 > http [ACK] Seq=646 Ack=352 Win=15680 Len=0 TSV=5884789 TSER=728518017
229  16.421631 27.60.129.157 -> 223.165.31.15 TCP 57594 > http [FIN, ACK] Seq=1 Ack=1 Win=14608 Len=0 TSV=5884830 TSER=0
230  16.421875 27.60.129.157 -> 23.35.20.211 TCP 54793 > http [FIN, ACK] Seq=1 Ack=1 Win=14608 Len=0 TSV=5884830 TSER=3568960365
231  16.421998 27.60.129.157 -> 23.35.20.211 TCP 54789 > http [FIN, ACK] Seq=437 Ack=214 Win=15680 Len=0 TSV=5884830 TSER=3105878871
232  16.422115 27.60.129.157 -> 223.165.31.12 TCP 51573 > http [FIN, ACK] Seq=1 Ack=1 Win=14608 Len=0 TSV=5884830 TSER=0
233  16.422217 27.60.129.157 -> 223.165.31.12 TCP 51568 > http [FIN, ACK] Seq=1206 Ack=537 Win=16752 Len=0 TSV=5884830 TSER=346615659
234  16.422316 27.60.129.157 -> 223.165.31.19 TCP 35053 > http [FIN, ACK] Seq=1 Ack=1 Win=14608 Len=0 TSV=5884830 TSER=0
235  16.422513 27.60.129.157 -> 223.165.31.19 TCP 35048 > http [FIN, ACK] Seq=1206 Ack=469 Win=16752 Len=0 TSV=5884831 TSER=141335014
236  16.422694 27.60.129.157 -> 96.17.182.40 TCP 48427 > http [FIN, ACK] Seq=3140 Ack=41602 Win=64096 Len=0 TSV=5884831 TSER=3579888737
237  16.422983 27.60.129.157 -> 31.13.79.4   TCP 40326 > http [SYN] Seq=0 Win=14600 Len=0 MSS=1460 SACK_PERM=1 TSV=5884831 TSER=0 WS=1
238  16.460556 27.60.129.157 -> 223.165.31.12 TCP 51587 > http [SYN] Seq=0 Win=14600 Len=0 MSS=1460 SACK_PERM=1 TSV=5884838 TSER=0 WS=1
239  16.463114 27.60.129.157 -> 223.165.31.12 TCP 51588 > http [SYN] Seq=0 Win=14600 Len=0 MSS=1460 SACK_PERM=1 TSV=5884839 TSER=0 WS=1
240  16.513165 27.60.129.157 -> 223.165.25.37 TCP 46981 > http [FIN, ACK] Seq=1 Ack=1 Win=14608 Len=0 TSV=5884849 TSER=0
241  16.513493 27.60.129.157 -> 223.165.25.37 TCP 46980 > http [FIN, ACK] Seq=1 Ack=1 Win=14608 Len=0 TSV=5884849 TSER=0
242  16.513850 27.60.129.157 -> 223.165.31.12 TCP 51589 > http [SYN] Seq=0 Win=14600 Len=0 MSS=1460 SACK_PERM=1 TSV=5884849 TSER=0 WS=1
243  16.520776 27.60.129.157 -> 202.79.210.121 TCP 35902 > http [SYN] Seq=0 Win=14600 Len=0 MSS=1460 SACK_PERM=1 TSV=5884850 TSER=0 WS=1
244  16.558707 96.17.182.40 -> 27.60.129.157 TCP http > 48427 [FIN, ACK] Seq=41602 Ack=3141 Win=25744 Len=0 TSV=3579891614 TSER=5884831
245  16.558888 27.60.129.157 -> 96.17.182.40 TCP 48427 > http [ACK] Seq=3141 Ack=41603 Win=64096 Len=0 TSV=5884858 TSER=3579891614
246  16.593648 23.35.20.211 -> 27.60.129.157 TCP http > 54793 [FIN, ACK] Seq=1 Ack=2 Win=14480 Len=0 TSV=3568963198 TSER=5884830
247  16.593884 27.60.129.157 -> 23.35.20.211 TCP 54793 > http [ACK] Seq=2 Ack=2 Win=14608 Len=0 TSV=5884865 TSER=3568963198
248  16.593972 23.35.20.211 -> 27.60.129.157 TCP http > 54789 [FIN, ACK] Seq=214 Ack=438 Win=15552 Len=0 TSV=3105881135 TSER=5884830
249  16.594062 27.60.129.157 -> 23.35.20.211 TCP 54789 > http [ACK] Seq=438 Ack=215 Win=15680 Len=0 TSV=5884865 TSER=3105881135
250  16.594098 223.165.25.37 -> 27.60.129.157 TCP http > 46981 [ACK] Seq=1 Ack=2 Win=64240 Len=0 TSV=216359819 TSER=5884849
251  16.594165 223.165.25.37 -> 27.60.129.157 TCP http > 46981 [RST, ACK] Seq=1 Ack=2 Win=0 Len=0
252  16.594210 223.165.25.37 -> 27.60.129.157 TCP http > 46980 [ACK] Seq=1 Ack=2 Win=64240 Len=0 TSV=216359819 TSER=5884421
253  16.603887 223.165.25.37 -> 27.60.129.157 TCP http > 46980 [RST, ACK] Seq=1 Ack=2 Win=0 Len=0
254  16.604012 223.165.31.19 -> 27.60.129.157 TCP http > 35053 [ACK] Seq=1 Ack=2 Win=65535 Len=0 TSV=141335152 TSER=5884830
255  16.604089 223.165.31.19 -> 27.60.129.157 TCP http > 35053 [RST, ACK] Seq=1 Ack=2 Win=0 Len=0
256  16.604125 223.165.31.12 -> 27.60.129.157 TCP http > 51568 [ACK] Seq=537 Ack=1207 Win=64330 Len=0 TSV=346615684 TSER=5884830
257  16.604170 223.165.31.12 -> 27.60.129.157 TCP http > 51573 [ACK] Seq=1 Ack=2 Win=65535 Len=0 TSV=411807983 TSER=5884830
258  16.604209 223.165.31.12 -> 27.60.129.157 TCP http > 51568 [FIN, ACK] Seq=537 Ack=1207 Win=64330 Len=0 TSV=346615684 TSER=5884830
259  16.604266 27.60.129.157 -> 223.165.31.12 TCP 51568 > http [ACK] Seq=1207 Ack=538 Win=16752 Len=0 TSV=5884867 TSER=346615684
260  16.604291 223.165.31.12 -> 27.60.129.157 TCP http > 51573 [RST, ACK] Seq=1 Ack=2 Win=0 Len=0
261  16.604316 223.165.31.19 -> 27.60.129.157 TCP http > 35048 [ACK] Seq=469 Ack=1207 Win=64330 Len=0 TSV=141335039 TSER=5884831
262  16.604355 223.165.31.19 -> 27.60.129.157 TCP http > 35048 [FIN, ACK] Seq=469 Ack=1207 Win=64330 Len=0 TSV=141335039 TSER=5884831
263  16.604394 27.60.129.157 -> 223.165.31.19 TCP 35048 > http [ACK] Seq=1207 Ack=470 Win=16752 Len=0 TSV=5884867 TSER=141335039
264  16.604421 223.165.31.15 -> 27.60.129.157 TCP http > 57594 [ACK] Seq=1 Ack=2 Win=65535 Len=0 TSV=22602832 TSER=5884253
265  16.604468 223.165.31.15 -> 27.60.129.157 TCP http > 57594 [RST, ACK] Seq=1 Ack=2 Win=0 Len=0
266  16.604690 223.165.31.12 -> 27.60.129.157 TCP http > 51587 [SYN, ACK] Seq=0 Ack=1 Win=16384 Len=0 MSS=1380 WS=0 TSV=0 TSER=0 SACK_PERM=1
267  16.604780 27.60.129.157 -> 223.165.31.12 TCP 51587 > http [ACK] Seq=1 Ack=1 Win=14600 Len=0 TSV=5884867 TSER=0
268  16.605619 27.60.129.157 -> 223.165.31.12 HTTP GET /ads.dll/getad?slotid=12 [Packet size limited during capture]
269  16.605843 27.60.129.157 -> 223.165.31.12 HTTP Continuation or non-HTTP traffic[Packet size limited during capture]
270  16.608512 223.165.31.12 -> 27.60.129.157 TCP http > 51588 [SYN, ACK] Seq=0 Ack=1 Win=16384 Len=0 MSS=1380 WS=0 TSV=0 TSER=0 SACK_PERM=1
271  16.608672 27.60.129.157 -> 223.165.31.12 TCP 51588 > http [ACK] Seq=1 Ack=1 Win=14600 Len=0 TSV=5884868 TSER=0
272  16.612466 27.60.129.157 -> 223.165.31.12 HTTP GET /ads.dll/getad?slotid=12 [Packet size limited during capture]
273  16.612726 27.60.129.157 -> 223.165.31.12 HTTP Continuation or non-HTTP traffic[Packet size limited during capture]
274  16.614613 223.165.31.12 -> 27.60.129.157 TCP http > 51589 [SYN, ACK] Seq=0 Ack=1 Win=16384 Len=0 MSS=1380 WS=0 TSV=0 TSER=0 SACK_PERM=1
275  16.614768 27.60.129.157 -> 223.165.31.12 TCP 51589 > http [ACK] Seq=1 Ack=1 Win=14600 Len=0 TSV=5884869 TSER=0
276  16.615191 27.60.129.157 -> 223.165.31.12 HTTP GET /ads.dll/getad?slotid=66 [Packet size limited during capture]
277  16.615306 27.60.129.157 -> 223.165.31.12 HTTP Continuation or non-HTTP traffic[Packet size limited during capture]
278  16.634761   31.13.79.4 -> 27.60.129.157 TCP http > 40326 [SYN, ACK] Seq=0 Ack=1 Win=14480 Len=0 MSS=1380 SACK_PERM=1 TSV=2008233479 TSER=5884831 WS=9
279  16.635005 27.60.129.157 -> 31.13.79.4   TCP 40326 > http [ACK] Seq=1 Ack=1 Win=14600 Len=0 TSV=5884873 TSER=2008233479
280  16.635597 27.60.129.157 -> 31.13.79.4   HTTP GET /plugins/like.php?app_id [Packet size limited during capture]
281  16.644505 202.79.210.121 -> 27.60.129.157 TCP http > 35902 [SYN, ACK] Seq=0 Ack=1 Win=8192 Len=0 MSS=1380 WS=8 SACK_PERM=1 TSV=122869968 TSER=5884850
282  16.644698 27.60.129.157 -> 202.79.210.121 TCP 35902 > http [ACK] Seq=1 Ack=1 Win=14600 Len=0 TSV=5884875 TSER=122869968
283  16.645193 27.60.129.157 -> 202.79.210.121 HTTP GET /BurstingPipe/adServer.b [Packet size limited during capture]
284  16.645401 27.60.129.157 -> 202.79.210.121 HTTP Continuation or non-HTTP traffic[Packet size limited during capture]
285  16.764843 223.165.31.12 -> 27.60.129.157 TCP http > 51587 [ACK] Seq=1 Ack=1437 Win=65535 Len=0 TSV=141334815 TSER=5884838
286  16.773463 223.165.31.12 -> 27.60.129.157 HTTP HTTP/1.1 200 OK [Packet size limited during capture]
287  16.773640 27.60.129.157 -> 223.165.31.12 TCP 51587 > http [ACK] Seq=1437 Ack=193 Win=15672 Len=0 TSV=5884901 TSER=141334815
288  16.773726 223.165.31.12 -> 27.60.129.157 HTTP Continuation or non-HTTP traffic[Packet size limited during capture]
289  16.773834 27.60.129.157 -> 223.165.31.12 TCP 51587 > http [ACK] Seq=1437 Ack=1005 Win=18568 Len=0 TSV=5884901 TSER=141334815
290  16.778740 223.165.31.12 -> 27.60.129.157 TCP [TCP Window Update] http > 51588 [ACK] Seq=1 Ack=1 Win=65535 Len=0 TSV=141334815 TSER=5884869 SLE=1369 SRE=1437
291  16.782785 223.165.31.12 -> 27.60.129.157 TCP [TCP Dup ACK 290#1] http > 51588 [ACK] Seq=1 Ack=1 Win=65535 Len=0 TSV=141334815 TSER=5884869 SLE=1369 SRE=1437
292  16.873522 223.165.31.12 -> 27.60.129.157 TCP [TCP Window Update] http > 51589 [ACK] Seq=1 Ack=1 Win=65535 Len=0 TSV=346629992 TSER=5884869 SLE=1369 SRE=1436
293  16.873689 223.165.31.12 -> 27.60.129.157 TCP http > 51589 [ACK] Seq=1 Ack=1436 Win=65535 Len=0 TSV=346629992 TSER=5884869
294  16.873743 223.165.31.12 -> 27.60.129.157 HTTP HTTP/1.1 200 OK [Packet size limited during capture]
295  16.873814 27.60.129.157 -> 223.165.31.12 TCP 51589 > http [ACK] Seq=1436 Ack=193 Win=15672 Len=0 TSV=5884921 TSER=346629992
296  16.883748 223.165.31.12 -> 27.60.129.157 HTTP Continuation or non-HTTP traffic[Packet size limited during capture]
297  16.883865 27.60.129.157 -> 223.165.31.12 TCP 51589 > http [ACK] Seq=1436 Ack=1069 Win=18568 Len=0 TSV=5884923 TSER=346629992
298  16.918871   31.13.79.4 -> 27.60.129.157 TCP http > 40326 [ACK] Seq=1 Ack=1197 Win=16896 Len=0 TSV=2008233765 TSER=5884873
299  16.956788 202.79.210.121 -> 27.60.129.157 TCP http > 35902 [ACK] Seq=1 Ack=1790 Win=65536 Len=0 TSV=122869999 TSER=5884875
300  16.973780 202.79.210.121 -> 27.60.129.157 HTTP HTTP/1.1 200 OK [Packet size limited during capture]
301  16.973954 27.60.129.157 -> 202.79.210.121 TCP 35902 > http [ACK] Seq=1790 Ack=1369 Win=17496 Len=0 TSV=5884941 TSER=122869999
302  16.974015 202.79.210.121 -> 27.60.129.157 HTTP Continuation or non-HTTP traffic[Packet size limited during capture]
303  16.974096 27.60.129.157 -> 202.79.210.121 TCP 35902 > http [ACK] Seq=1790 Ack=2737 Win=20392 Len=0 TSV=5884941 TSER=122869999
304  17.101725 27.60.129.157 -> 96.17.182.58 TCP 55083 > http [FIN, ACK] Seq=1 Ack=1 Win=14608 Len=0 TSV=5884966 TSER=3566929571
305  17.102116 27.60.129.157 -> 223.165.25.37 TCP 46979 > http [FIN, ACK] Seq=1434 Ack=235 Win=15680 Len=0 TSV=5884966 TSER=216359800
306  17.102340 27.60.129.157 -> 74.125.236.25 TCP 41490 > http [FIN, ACK] Seq=1 Ack=1 Win=14600 Len=0 TSV=5884966 TSER=2063807358
307  17.102641 27.60.129.157 -> 223.165.25.37 TCP 46978 > http [FIN, ACK] Seq=1524 Ack=723 Win=15968 Len=0 TSV=5884967 TSER=216359803
308  17.102839 27.60.129.157 -> 74.125.236.4 TCP 54122 > http [FIN, ACK] Seq=1 Ack=1 Win=14608 Len=0 TSV=5884967 TSER=2063733080
309  17.103382 27.60.129.157 -> 96.17.182.65 TCP 44012 > http [SYN] Seq=0 Win=14600 Len=0 MSS=1460 SACK_PERM=1 TSV=5884967 TSER=0 WS=1
310  17.120665 202.79.210.121 -> 27.60.129.157 HTTP Continuation or non-HTTP traffic[Packet size limited during capture]
311  17.121160 27.60.129.157 -> 202.79.210.121 TCP 35902 > http [FIN, ACK] Seq=1790 Ack=2784 Win=20392 Len=0 TSV=5884970 TSER=122870015
312  17.143267 27.60.129.157 -> 96.17.182.50 TCP 56160 > http [SYN] Seq=0 Win=14600 Len=0 MSS=1460 SACK_PERM=1 TSV=5884975 TSER=0 WS=1
313  17.147016 96.17.182.58 -> 27.60.129.157 TCP http > 55083 [ACK] Seq=1 Ack=2 Win=14480 Len=0 TSV=3566931721 TSER=5884966
314  17.149157 96.17.182.58 -> 27.60.129.157 TCP http > 55083 [FIN, ACK] Seq=1 Ack=2 Win=14480 Len=0 TSV=3566931721 TSER=5884966
315  17.149817 27.60.129.157 -> 96.17.182.58 TCP 55083 > http [ACK] Seq=2 Ack=2 Win=14608 Len=0 TSV=5884976 TSER=3566931721
