  1   0.000000 180.149.52.3 -> 106.202.133.241 TCP 242 irdmi > 53525 [PSH, ACK] Seq=1 Ack=1 Win=1944 Len=174 TSval=999307970 TSecr=938143
  2   0.000492 106.202.133.241 -> 180.149.52.3 TCP 68 53525 > irdmi [ACK] Seq=1 Ack=175 Win=7836 Len=0 TSval=938581 TSecr=999307970
  3   0.126613 106.202.133.241 -> 122.160.120.56 DNS 78 Standard query 0xe054  A timesofindia.com
  4   2.550514 180.149.52.3 -> 106.202.133.241 TCP 242 [TCP Retransmission] irdmi > 53525 [PSH, ACK] Seq=1 Ack=1 Win=1944 Len=174 TSval=999308582 TSecr=938143
  5   2.551040 106.202.133.241 -> 180.149.52.3 TCP 80 [TCP Dup ACK 2#1] 53525 > irdmi [ACK] Seq=1 Ack=175 Win=7836 Len=0 TSval=939091 TSecr=999308582 SLE=1 SRE=175
  6   2.854940 122.160.120.56 -> 106.202.133.241 DNS 94 Standard query response 0xe054  A 223.165.25.18
  7   2.857068 106.202.133.241 -> 223.165.25.18 TCP 76 42932 > http [SYN] Seq=0 Win=14600 Len=0 MSS=1460 SACK_PERM=1 TSval=939152 TSecr=0 WS=2
  8   2.976118 223.165.25.18 -> 106.202.133.241 TCP 76 http > 42932 [SYN, ACK] Seq=0 Ack=1 Win=5792 Len=0 MSS=1380 SACK_PERM=1 TSval=906061399 TSecr=939152 WS=128
  9   2.976316 106.202.133.241 -> 223.165.25.18 TCP 68 42932 > http [ACK] Seq=1 Ack=1 Win=14600 Len=0 TSval=939176 TSecr=906061399
 10   2.977543 106.202.133.241 -> 223.165.25.18 HTTP 530 GET / HTTP/1.1 
 11   3.121180 223.165.25.18 -> 106.202.133.241 TCP 68 http > 42932 [ACK] Seq=1 Ack=463 Win=6912 Len=0 TSval=906061542 TSecr=939177
 12   3.132021 223.165.25.18 -> 106.202.133.241 HTTP 581 HTTP/1.1 301 Moved Permanently  (text/html)
 13   3.132106 106.202.133.241 -> 223.165.25.18 TCP 68 42932 > http [ACK] Seq=463 Ack=514 Win=15672 Len=0 TSval=939207 TSecr=906061542
 14   3.184608 106.202.133.241 -> 122.160.120.56 DNS 82 Standard query 0x808d  A www.timesofindia.com
 15   3.251382 122.160.120.56 -> 106.202.133.241 DNS 198 Standard query response 0x808d  CNAME timesofindia.indiatimes.com.edgesuite.net CNAME a1521.g.akamai.net A 96.17.182.65 A 96.17.182.40
 16   3.253313 106.202.133.241 -> 96.17.182.65 TCP 76 34902 > http [SYN] Seq=0 Win=14600 Len=0 MSS=1460 SACK_PERM=1 TSval=939232 TSecr=0 WS=2
 17   3.284912 106.202.133.241 -> 180.149.52.3 TCP 68 48843 > irdmi [FIN, ACK] Seq=1 Ack=1 Win=7300 Len=0 TSval=939238 TSecr=999307408
 18   3.287003 106.202.133.241 -> 180.149.52.3 TCP 68 53525 > irdmi [FIN, ACK] Seq=1 Ack=175 Win=7836 Len=0 TSval=939238 TSecr=999308582
 19   3.308189 96.17.182.65 -> 106.202.133.241 TCP 76 http > 34902 [SYN, ACK] Seq=0 Ack=1 Win=14480 Len=0 MSS=1380 SACK_PERM=1 TSval=3173228598 TSecr=939232 WS=2
 20   3.308577 106.202.133.241 -> 96.17.182.65 TCP 68 34902 > http [ACK] Seq=1 Ack=1 Win=14600 Len=0 TSval=939243 TSecr=3173228598
 21   3.309505 106.202.133.241 -> 96.17.182.65 HTTP 534 GET / HTTP/1.1 
 22   3.380000 180.149.52.3 -> 106.202.133.241 TCP 68 irdmi > 53525 [FIN, ACK] Seq=175 Ack=2 Win=1944 Len=0 TSval=999308837 TSecr=939238
 23   3.380101 106.202.133.241 -> 180.149.52.3 TCP 68 53525 > irdmi [ACK] Seq=2 Ack=176 Win=7836 Len=0 TSval=939257 TSecr=999308837
 24   3.380189 180.149.52.3 -> 106.202.133.241 TCP 68 irdmi > 48843 [FIN, ACK] Seq=1 Ack=2 Win=1944 Len=0 TSval=999308837 TSecr=939238
 25   3.380229 106.202.133.241 -> 180.149.52.3 TCP 68 48843 > irdmi [ACK] Seq=2 Ack=2 Win=7300 Len=0 TSval=939257 TSecr=999308837
 26   3.381844 96.17.182.65 -> 106.202.133.241 TCP 68 http > 34902 [ACK] Seq=1 Ack=467 Win=15552 Len=0 TSval=3173228671 TSecr=939243
 27   3.391346 96.17.182.65 -> 106.202.133.241 HTTP 345 HTTP/1.1 301 Moved Permanently 
 28   3.391385 106.202.133.241 -> 96.17.182.65 TCP 68 34902 > http [ACK] Seq=467 Ack=278 Win=15672 Len=0 TSval=939259 TSecr=3173228671
 29   3.418695 106.202.133.241 -> 122.160.120.56 DNS 80 Standard query 0x1328  A m.timesofindia.com
 30   3.471199 122.160.120.56 -> 106.202.133.241 DNS 191 Standard query response 0x1328  CNAME epaper.timesofindia.com.edgesuite.net CNAME a125.g.akamai.net A 96.17.182.66 A 96.17.182.67
 31   3.472088 106.202.133.241 -> 96.17.182.66 TCP 76 48651 > http [SYN] Seq=0 Win=14600 Len=0 MSS=1460 SACK_PERM=1 TSval=939275 TSecr=0 WS=2
 32   3.511958 96.17.182.66 -> 106.202.133.241 TCP 76 http > 48651 [SYN, ACK] Seq=0 Ack=1 Win=14480 Len=0 MSS=1380 SACK_PERM=1 TSval=765645686 TSecr=939275 WS=2
 33   3.512157 106.202.133.241 -> 96.17.182.66 TCP 68 48651 > http [ACK] Seq=1 Ack=1 Win=14600 Len=0 TSval=939283 TSecr=765645686
 34   3.512836 106.202.133.241 -> 96.17.182.66 HTTP 532 GET / HTTP/1.1 
 35   3.592313 96.17.182.66 -> 106.202.133.241 TCP 68 http > 48651 [ACK] Seq=1 Ack=465 Win=15552 Len=0 TSval=765645752 TSecr=939284
 36   3.601543 96.17.182.66 -> 106.202.133.241 TCP 1436 [TCP segment of a reassembled PDU]
 37   3.601759 106.202.133.241 -> 96.17.182.66 TCP 68 48651 > http [ACK] Seq=465 Ack=1369 Win=17496 Len=0 TSval=939301 TSecr=765645752
 38   3.646200 96.17.182.66 -> 106.202.133.241 TCP 1436 [TCP segment of a reassembled PDU]
 39   3.646351 106.202.133.241 -> 96.17.182.66 TCP 68 48651 > http [ACK] Seq=465 Ack=2737 Win=20392 Len=0 TSval=939310 TSecr=765645752
 40   3.651183 96.17.182.66 -> 106.202.133.241 TCP 1436 [TCP segment of a reassembled PDU]
 41   3.651332 106.202.133.241 -> 96.17.182.66 TCP 68 48651 > http [ACK] Seq=465 Ack=4105 Win=23288 Len=0 TSval=939311 TSecr=765645752
 42   3.682413 96.17.182.66 -> 106.202.133.241 TCP 1436 [TCP segment of a reassembled PDU]
 43   3.682633 106.202.133.241 -> 96.17.182.66 TCP 68 48651 > http [ACK] Seq=465 Ack=5473 Win=26184 Len=0 TSval=939318 TSecr=765645752
 44   3.701295 96.17.182.66 -> 106.202.133.241 TCP 1436 [TCP segment of a reassembled PDU]
 45   3.701453 106.202.133.241 -> 96.17.182.66 TCP 68 48651 > http [ACK] Seq=465 Ack=6841 Win=29080 Len=0 TSval=939321 TSecr=765645752
 46   3.736176 96.17.182.66 -> 106.202.133.241 TCP 1436 [TCP segment of a reassembled PDU]
 47   3.736318 106.202.133.241 -> 96.17.182.66 TCP 68 48651 > http [ACK] Seq=465 Ack=8209 Win=31976 Len=0 TSval=939328 TSecr=765645752
 48   3.761447 96.17.182.66 -> 106.202.133.241 TCP 1436 [TCP segment of a reassembled PDU]
 49   3.761604 106.202.133.241 -> 96.17.182.66 TCP 68 48651 > http [ACK] Seq=465 Ack=9577 Win=34872 Len=0 TSval=939333 TSecr=765645752
 50   3.781257 96.17.182.66 -> 106.202.133.241 TCP 1436 [TCP segment of a reassembled PDU]
 51   3.781372 106.202.133.241 -> 96.17.182.66 TCP 68 48651 > http [ACK] Seq=465 Ack=10945 Win=37768 Len=0 TSval=939337 TSecr=765645752
 52   3.781401 96.17.182.66 -> 106.202.133.241 HTTP/XML 174 HTTP/1.1 200 OK 
 53   3.781429 106.202.133.241 -> 96.17.182.66 TCP 68 48651 > http [ACK] Seq=465 Ack=11051 Win=37768 Len=0 TSval=939337 TSecr=765645752
 54   3.801685 106.202.133.241 -> 96.17.182.66 HTTP 541 GET /mobilecss_new.cms HTTP/1.1 
 55   3.817061 106.202.133.241 -> 96.17.182.66 TCP 76 48652 > http [SYN] Seq=0 Win=14600 Len=0 MSS=1460 SACK_PERM=1 TSval=939344 TSecr=0 WS=2
 56   3.901767 96.17.182.66 -> 106.202.133.241 TCP 1436 [TCP segment of a reassembled PDU]
 57   3.924141 96.17.182.66 -> 106.202.133.241 TCP 1436 [TCP segment of a reassembled PDU]
 58   3.924260 106.202.133.241 -> 96.17.182.66 TCP 68 48651 > http [ACK] Seq=938 Ack=13787 Win=43560 Len=0 TSval=939366 TSecr=765646041
 59   3.931985 96.17.182.66 -> 106.202.133.241 HTTP 1036 HTTP/1.1 200 OK  (text/css)
 60   3.932071 96.17.182.66 -> 106.202.133.241 TCP 76 http > 48652 [SYN, ACK] Seq=0 Ack=1 Win=14480 Len=0 MSS=1380 SACK_PERM=1 TSval=765646042 TSecr=939344 WS=2
 61   3.932135 106.202.133.241 -> 96.17.182.66 TCP 68 48652 > http [ACK] Seq=1 Ack=1 Win=14600 Len=0 TSval=939367 TSecr=765646042
 62   3.933298 106.202.133.241 -> 96.17.182.66 HTTP 526 GET /beta_gohintjs.cms HTTP/1.1 
 63   3.958326 106.202.133.241 -> 122.160.120.56 DNS 77 Standard query 0x5777  A wap.bonzai.mobi
 64   3.959766 106.202.133.241 -> 122.160.120.56 DNS 89 Standard query 0x5d43  A timesofindia.indiatimes.com
 65   3.964274 106.202.133.241 -> 122.160.120.56 DNS 85 Standard query 0x6ee7  A www1.m.timesofindia.com
 66   3.967498 106.202.133.241 -> 96.17.182.66 TCP 68 48651 > http [ACK] Seq=938 Ack=14755 Win=46456 Len=0 TSval=939375 TSecr=765646041
 67   3.968588 106.202.133.241 -> 96.17.182.66 HTTP 526 GET /photo/7361540.cms HTTP/1.1 
 68   3.971330 106.202.133.241 -> 96.17.182.66 TCP 76 48653 > http [SYN] Seq=0 Win=14600 Len=0 MSS=1460 SACK_PERM=1 TSval=939375 TSecr=0 WS=2
 69   3.971529 106.202.133.241 -> 96.17.182.66 TCP 76 48654 > http [SYN] Seq=0 Win=14600 Len=0 MSS=1460 SACK_PERM=1 TSval=939375 TSecr=0 WS=2
 70   3.972909 106.202.133.241 -> 96.17.182.66 TCP 76 48655 > http [SYN] Seq=0 Win=14600 Len=0 MSS=1460 SACK_PERM=1 TSval=939376 TSecr=0 WS=2
 71   3.973011 106.202.133.241 -> 96.17.182.66 TCP 76 48656 > http [SYN] Seq=0 Win=14600 Len=0 MSS=1460 SACK_PERM=1 TSval=939376 TSecr=0 WS=2
 72   3.996192 96.17.182.66 -> 106.202.133.241 TCP 68 http > 48652 [ACK] Seq=1 Ack=459 Win=15552 Len=0 TSval=765646170 TSecr=939368
 73   4.000125 122.160.120.56 -> 106.202.133.241 DNS 165 Standard query response 0x5777  CNAME bonzaidelivery-1424264725.ap-southeast-1.elb.amazonaws.com A 122.248.235.235
 74   4.001048 106.202.133.241 -> 122.248.235.235 TCP 76 58136 > http [SYN] Seq=0 Win=14600 Len=0 MSS=1460 SACK_PERM=1 TSval=939381 TSecr=0 WS=2
 75   4.015865 122.160.120.56 -> 106.202.133.241 DNS 205 Standard query response 0x5d43  CNAME timesofindia.indiatimes.com.edgesuite.net CNAME a1521.g.akamai.net A 96.17.182.40 A 96.17.182.65
 76   4.016475 106.202.133.241 -> 96.17.182.40 TCP 76 34988 > http [SYN] Seq=0 Win=14600 Len=0 MSS=1460 SACK_PERM=1 TSval=939384 TSecr=0 WS=2
 77   4.016573 106.202.133.241 -> 96.17.182.40 TCP 76 34989 > http [SYN] Seq=0 Win=14600 Len=0 MSS=1460 SACK_PERM=1 TSval=939384 TSecr=0 WS=2
 78   4.016653 106.202.133.241 -> 96.17.182.40 TCP 76 34990 > http [SYN] Seq=0 Win=14600 Len=0 MSS=1460 SACK_PERM=1 TSval=939384 TSecr=0 WS=2
 79   4.016726 106.202.133.241 -> 96.17.182.40 TCP 76 34991 > http [SYN] Seq=0 Win=14600 Len=0 MSS=1460 SACK_PERM=1 TSval=939384 TSecr=0 WS=2
 80   4.016796 106.202.133.241 -> 96.17.182.40 TCP 76 34992 > http [SYN] Seq=0 Win=14600 Len=0 MSS=1460 SACK_PERM=1 TSval=939384 TSecr=0 WS=2
 81   4.016860 106.202.133.241 -> 96.17.182.40 TCP 76 34993 > http [SYN] Seq=0 Win=14600 Len=0 MSS=1460 SACK_PERM=1 TSval=939384 TSecr=0 WS=2
 82   4.016925 106.202.133.241 -> 96.17.182.40 TCP 76 34994 > http [SYN] Seq=0 Win=14600 Len=0 MSS=1460 SACK_PERM=1 TSval=939384 TSecr=0 WS=2
 83   4.031733 122.160.120.56 -> 106.202.133.241 DNS 101 Standard query response 0x6ee7  A 223.165.25.44
 84   4.032286 106.202.133.241 -> 223.165.25.44 TCP 76 51096 > http [SYN] Seq=0 Win=14600 Len=0 MSS=1460 SACK_PERM=1 TSval=939387 TSecr=0 WS=2
 85   4.066145 96.17.182.66 -> 106.202.133.241 HTTP 1000 HTTP/1.1 200 OK  (GIF89a)
 86   4.066250 106.202.133.241 -> 96.17.182.66 TCP 68 48651 > http [ACK] Seq=1396 Ack=15687 Win=49352 Len=0 TSval=939394 TSecr=765646209
 87   4.066269 96.17.182.66 -> 106.202.133.241 TCP 76 http > 48653 [SYN, ACK] Seq=0 Ack=1 Win=14480 Len=0 MSS=1380 SACK_PERM=1 TSval=765646211 TSecr=939375 WS=2
 88   4.066316 106.202.133.241 -> 96.17.182.66 TCP 68 48653 > http [ACK] Seq=1 Ack=1 Win=14600 Len=0 TSval=939394 TSecr=765646211
 89   4.067918 106.202.133.241 -> 96.17.182.66 HTTP 526 GET /photo/8038781.cms HTTP/1.1 
 90   4.068474 106.202.133.241 -> 96.17.182.66 HTTP 526 GET /photo/8038727.cms HTTP/1.1 
 91   4.075888 96.17.182.66 -> 106.202.133.241 TCP 1436 [TCP segment of a reassembled PDU]
 92   4.076079 106.202.133.241 -> 96.17.182.66 TCP 68 48652 > http [ACK] Seq=459 Ack=1369 Win=17496 Len=0 TSval=939396 TSecr=765646226
 93   4.111230 96.17.182.66 -> 106.202.133.241 TCP 1436 [TCP segment of a reassembled PDU]
 94   4.111315 106.202.133.241 -> 96.17.182.66 TCP 68 48652 > http [ACK] Seq=459 Ack=2737 Win=20392 Len=0 TSval=939403 TSecr=765646226
 95   4.152393 96.17.182.66 -> 106.202.133.241 TCP 1436 [TCP segment of a reassembled PDU]
 96   4.152493 106.202.133.241 -> 96.17.182.66 TCP 68 48652 > http [ACK] Seq=459 Ack=4105 Win=23288 Len=0 TSval=939412 TSecr=765646226
 97   4.152523 96.17.182.66 -> 106.202.133.241 TCP 277 [TCP segment of a reassembled PDU]
 98   4.152551 106.202.133.241 -> 96.17.182.66 TCP 68 48652 > http [ACK] Seq=459 Ack=4314 Win=26024 Len=0 TSval=939412 TSecr=765646226
 99   4.180462 96.17.182.66 -> 106.202.133.241 TCP 1436 [TCP segment of a reassembled PDU]
100   4.180615 106.202.133.241 -> 96.17.182.66 TCP 68 48652 > http [ACK] Seq=459 Ack=5682 Win=28920 Len=0 TSval=939417 TSecr=765646226
101   4.180660 96.17.182.66 -> 106.202.133.241 TCP 1436 [TCP segment of a reassembled PDU]
102   4.180729 106.202.133.241 -> 96.17.182.66 TCP 68 48652 > http [ACK] Seq=459 Ack=7050 Win=31816 Len=0 TSval=939417 TSecr=765646226
103   4.186072 96.17.182.66 -> 106.202.133.241 TCP 228 [TCP segment of a reassembled PDU]
104   4.186190 106.202.133.241 -> 96.17.182.66 TCP 68 48652 > http [ACK] Seq=459 Ack=7210 Win=34552 Len=0 TSval=939418 TSecr=765646226
105   4.186226 96.17.182.66 -> 106.202.133.241 TCP 76 http > 48655 [SYN, ACK] Seq=0 Ack=1 Win=14480 Len=0 MSS=1380 SACK_PERM=1 TSval=765646229 TSecr=939376 WS=2
106   4.186333 106.202.133.241 -> 96.17.182.66 TCP 68 48655 > http [ACK] Seq=1 Ack=1 Win=14600 Len=0 TSval=939418 TSecr=765646229
107   4.186350 96.17.182.66 -> 106.202.133.241 TCP 76 http > 48654 [SYN, ACK] Seq=0 Ack=1 Win=14480 Len=0 MSS=1380 SACK_PERM=1 TSval=765646229 TSecr=939375 WS=2
108   4.186439 106.202.133.241 -> 96.17.182.66 TCP 68 48654 > http [ACK] Seq=1 Ack=1 Win=14600 Len=0 TSval=939418 TSecr=765646229
109   4.186457 96.17.182.66 -> 106.202.133.241 TCP 76 http > 48656 [SYN, ACK] Seq=0 Ack=1 Win=14480 Len=0 MSS=1380 SACK_PERM=1 TSval=765646229 TSecr=939376 WS=2
110   4.186537 106.202.133.241 -> 96.17.182.66 TCP 68 48656 > http [ACK] Seq=1 Ack=1 Win=14600 Len=0 TSval=939418 TSecr=765646229
111   4.187318 106.202.133.241 -> 96.17.182.66 HTTP 526 GET /photo/8038769.cms HTTP/1.1 
112   4.188057 106.202.133.241 -> 96.17.182.66 HTTP 526 GET /photo/8038820.cms HTTP/1.1 
113   4.192055 96.17.182.40 -> 106.202.133.241 TCP 76 http > 34988 [SYN, ACK] Seq=0 Ack=1 Win=14480 Len=0 MSS=1380 SACK_PERM=1 TSval=3912059126 TSecr=939384 WS=2
114   4.192264 106.202.133.241 -> 96.17.182.40 TCP 68 34988 > http [ACK] Seq=1 Ack=1 Win=14600 Len=0 TSval=939419 TSecr=3912059126
115   4.192520 96.17.182.40 -> 106.202.133.241 TCP 76 http > 34989 [SYN, ACK] Seq=0 Ack=1 Win=14480 Len=0 MSS=1380 SACK_PERM=1 TSval=3912059130 TSecr=939384 WS=2
116   4.192672 106.202.133.241 -> 96.17.182.40 TCP 68 34989 > http [ACK] Seq=1 Ack=1 Win=14600 Len=0 TSval=939420 TSecr=3912059130
117   4.192708 96.17.182.40 -> 106.202.133.241 TCP 76 http > 34990 [SYN, ACK] Seq=0 Ack=1 Win=14480 Len=0 MSS=1380 SACK_PERM=1 TSval=3912059132 TSecr=939384 WS=2
118   4.192809 106.202.133.241 -> 96.17.182.40 TCP 68 34990 > http [ACK] Seq=1 Ack=1 Win=14600 Len=0 TSval=939420 TSecr=3912059132
119   4.192829 96.17.182.40 -> 106.202.133.241 TCP 76 http > 34991 [SYN, ACK] Seq=0 Ack=1 Win=14480 Len=0 MSS=1380 SACK_PERM=1 TSval=3912059136 TSecr=939384 WS=2
120   4.192920 106.202.133.241 -> 96.17.182.40 TCP 68 34991 > http [ACK] Seq=1 Ack=1 Win=14600 Len=0 TSval=939420 TSecr=3912059136
121   4.192940 96.17.182.40 -> 106.202.133.241 TCP 76 http > 34992 [SYN, ACK] Seq=0 Ack=1 Win=14480 Len=0 MSS=1380 SACK_PERM=1 TSval=3912059138 TSecr=939384 WS=2
122   4.193039 106.202.133.241 -> 96.17.182.40 TCP 68 34992 > http [ACK] Seq=1 Ack=1 Win=14600 Len=0 TSval=939420 TSecr=3912059138
123   4.193059 96.17.182.40 -> 106.202.133.241 TCP 76 http > 34993 [SYN, ACK] Seq=0 Ack=1 Win=14480 Len=0 MSS=1380 SACK_PERM=1 TSval=3912059142 TSecr=939384 WS=2
124   4.193077 106.202.133.241 -> 96.17.182.40 HTTP 1192 GET /photo/19765854.cms?resizemode=1 HTTP/1.1 
125   4.193165 106.202.133.241 -> 96.17.182.40 TCP 68 34993 > http [ACK] Seq=1 Ack=1 Win=14600 Len=0 TSval=939420 TSecr=3912059142
126   4.193188 96.17.182.40 -> 106.202.133.241 TCP 76 http > 34994 [SYN, ACK] Seq=0 Ack=1 Win=14480 Len=0 MSS=1380 SACK_PERM=1 TSval=3912059144 TSecr=939384 WS=2
127   4.193290 106.202.133.241 -> 96.17.182.40 TCP 68 34994 > http [ACK] Seq=1 Ack=1 Win=14600 Len=0 TSval=939420 TSecr=3912059144
128   4.194599 106.202.133.241 -> 96.17.182.40 HTTP 1192 GET /photo/19754699.cms?resizemode=1 HTTP/1.1 
129   4.195348 106.202.133.241 -> 96.17.182.40 HTTP 1192 GET /photo/19766505.cms?resizemode=1 HTTP/1.1 
130   4.196077 106.202.133.241 -> 96.17.182.40 HTTP 1192 GET /photo/19762626.cms?resizemode=1 HTTP/1.1 
131   4.196682 106.202.133.241 -> 96.17.182.40 HTTP 1192 GET /photo/19760755.cms?resizemode=1 HTTP/1.1 
132   4.197691 106.202.133.241 -> 96.17.182.40 HTTP 1192 GET /photo/19767268.cms?resizemode=1 HTTP/1.1 
133   4.198527 106.202.133.241 -> 96.17.182.40 HTTP 1192 GET /photo/18811025.cms?resizemode=1 HTTP/1.1 
134   4.210081 106.202.133.241 -> 122.248.235.235 TCP 76 58145 > http [SYN] Seq=0 Win=14600 Len=0 MSS=1460 SACK_PERM=1 TSval=939423 TSecr=0 WS=2
135   4.214554 106.202.133.241 -> 223.165.25.44 TCP 76 51098 > http [SYN] Seq=0 Win=14600 Len=0 MSS=1460 SACK_PERM=1 TSval=939424 TSecr=0 WS=2
136   4.230067 96.17.182.66 -> 106.202.133.241 TCP 1436 [TCP segment of a reassembled PDU]
137   4.230217 106.202.133.241 -> 96.17.182.66 TCP 68 48652 > http [ACK] Seq=459 Ack=8578 Win=37448 Len=0 TSval=939427 TSecr=765646269
138   4.244265 96.17.182.66 -> 106.202.133.241 TCP 1436 [TCP segment of a reassembled PDU]
139   4.244426 106.202.133.241 -> 96.17.182.66 TCP 68 48652 > http [ACK] Seq=459 Ack=9946 Win=40344 Len=0 TSval=939430 TSecr=765646269
140   4.260106 96.17.182.66 -> 106.202.133.241 HTTP 485 HTTP/1.1 200 OK  (text/javascript)
141   4.260303 106.202.133.241 -> 96.17.182.66 TCP 68 48652 > http [ACK] Seq=459 Ack=10363 Win=43080 Len=0 TSval=939433 TSecr=765646269
142   4.260453 223.165.25.44 -> 106.202.133.241 TCP 76 http > 51096 [SYN, ACK] Seq=0 Ack=1 Win=5792 Len=0 MSS=1380 SACK_PERM=1 TSval=884533488 TSecr=939387 WS=128
143   4.260692 106.202.133.241 -> 223.165.25.44 TCP 68 51096 > http [ACK] Seq=1 Ack=1 Win=14600 Len=0 TSval=939433 TSecr=884533488
144   4.261925 122.248.235.235 -> 106.202.133.241 TCP 76 http > 58136 [SYN, ACK] Seq=0 Ack=1 Win=14480 Len=0 MSS=1380 SACK_PERM=1 TSval=171809000 TSecr=939381 WS=256
145   4.262156 106.202.133.241 -> 122.248.235.235 TCP 68 58136 > http [ACK] Seq=1 Ack=1 Win=14600 Len=0 TSval=939433 TSecr=171809000
146   4.263313 106.202.133.241 -> 223.165.25.44 HTTP 670 GET /ga.jsp?utmac=MO-12812017-1&utmn=307973881&utmr=-&utmp=%2F&guid=ON HTTP/1.1 
147   4.263860 106.202.133.241 -> 122.248.235.235 HTTP 625 GET /AdDelivery/delivery.do?medium=js&zone=1424&referer=Home&weblink=http%3A%2F%2Fm.timesofindia.com%2F HTTP/1.1 
148   4.294418 96.17.182.66 -> 106.202.133.241 TCP 1436 [TCP segment of a reassembled PDU]
149   4.310105 96.17.182.66 -> 106.202.133.241 TCP 1436 [TCP segment of a reassembled PDU]
150   4.310321 106.202.133.241 -> 96.17.182.66 TCP 68 48651 > http [ACK] Seq=1854 Ack=18423 Win=55144 Len=0 TSval=939443 TSecr=765646311
151   4.346212 96.17.182.66 -> 106.202.133.241 TCP 1436 [TCP segment of a reassembled PDU]
152   4.361659 96.17.182.66 -> 106.202.133.241 TCP 1436 [TCP segment of a reassembled PDU]
153   4.361860 106.202.133.241 -> 96.17.182.66 TCP 68 48651 > http [ACK] Seq=1854 Ack=21159 Win=60936 Len=0 TSval=939453 TSecr=765646311
154   4.391557 96.17.182.66 -> 106.202.133.241 TCP 1436 [TCP segment of a reassembled PDU]
155   4.414427 96.17.182.66 -> 106.202.133.241 TCP 1436 [TCP segment of a reassembled PDU]
156   4.414611 106.202.133.241 -> 96.17.182.66 TCP 68 48651 > http [ACK] Seq=1854 Ack=23895 Win=64088 Len=0 TSval=939464 TSecr=765646311
157   4.414666 96.17.182.66 -> 106.202.133.241 HTTP 127 HTTP/1.1 200 OK  (JPEG JFIF image)
158   4.414716 96.17.182.66 -> 106.202.133.241 TCP 68 http > 48653 [ACK] Seq=1 Ack=459 Win=15552 Len=0 TSval=765646339 TSecr=939395
159   4.424245 96.17.182.66 -> 106.202.133.241 HTTP 1260 HTTP/1.1 200 OK  (JPEG JFIF image)
160   4.424447 106.202.133.241 -> 96.17.182.66 TCP 68 48653 > http [ACK] Seq=459 Ack=1193 Win=17496 Len=0 TSval=939466 TSecr=765646339
161   4.424498 96.17.182.66 -> 106.202.133.241 TCP 68 http > 48655 [ACK] Seq=1 Ack=459 Win=15552 Len=0 TSval=765646434 TSecr=939418
162   4.450278 96.17.182.66 -> 106.202.133.241 HTTP 1258 HTTP/1.1 200 OK  (JPEG JFIF image)
163   4.450482 106.202.133.241 -> 96.17.182.66 TCP 68 48655 > http [ACK] Seq=459 Ack=1191 Win=17496 Len=0 TSval=939471 TSecr=765646434
164   4.450546 96.17.182.66 -> 106.202.133.241 TCP 68 http > 48654 [ACK] Seq=1 Ack=459 Win=15552 Len=0 TSval=765646466 TSecr=939419
165   4.452558 106.202.133.241 -> 96.17.182.66 TCP 68 48651 > http [ACK] Seq=1854 Ack=23954 Win=64088 Len=0 TSval=939472 TSecr=765646311
166   4.491493 96.17.182.66 -> 106.202.133.241 HTTP 1104 HTTP/1.1 200 OK  (JPEG JFIF image)
167   4.491645 106.202.133.241 -> 96.17.182.66 TCP 68 48654 > http [ACK] Seq=459 Ack=1037 Win=17496 Len=0 TSval=939479 TSecr=765646467
168   4.491688 96.17.182.40 -> 106.202.133.241 TCP 68 http > 34988 [ACK] Seq=1 Ack=1125 Win=16728 Len=0 TSval=3912059450 TSecr=939420
169   4.501536 96.17.182.40 -> 106.202.133.241 TCP 1436 [TCP segment of a reassembled PDU]
170   4.501811 106.202.133.241 -> 96.17.182.40 TCP 68 34988 > http [ACK] Seq=1125 Ack=1369 Win=17496 Len=0 TSval=939481 TSecr=3912059450
171   4.509336 96.17.182.40 -> 106.202.133.241 TCP 1436 [TCP segment of a reassembled PDU]
172   4.509597 106.202.133.241 -> 96.17.182.40 TCP 68 34988 > http [ACK] Seq=1125 Ack=2737 Win=20392 Len=0 TSval=939483 TSecr=3912059450
173   4.532185 96.17.182.40 -> 106.202.133.241 TCP 1436 [TCP segment of a reassembled PDU]
174   4.532508 106.202.133.241 -> 96.17.182.40 TCP 68 34988 > http [ACK] Seq=1125 Ack=4105 Win=23288 Len=0 TSval=939487 TSecr=3912059450
175   4.608183 96.17.182.40 -> 106.202.133.241 TCP 1436 [TCP segment of a reassembled PDU]
176   4.608296 106.202.133.241 -> 96.17.182.40 TCP 68 34988 > http [ACK] Seq=1125 Ack=5473 Win=26184 Len=0 TSval=939503 TSecr=3912059450
177   4.636431 96.17.182.40 -> 106.202.133.241 TCP 1436 [TCP segment of a reassembled PDU]
178   4.636673 106.202.133.241 -> 96.17.182.40 TCP 68 34988 > http [ACK] Seq=1125 Ack=6841 Win=29080 Len=0 TSval=939508 TSecr=3912059450
179   4.952733 106.202.133.241 -> 223.165.25.44 HTTP 670 [TCP Retransmission] GET /ga.jsp?utmac=MO-12812017-1&utmn=307973881&utmr=-&utmp=%2F&guid=ON HTTP/1.1 
180   4.964527 96.17.182.40 -> 106.202.133.241 TCP 1436 [TCP segment of a reassembled PDU]
181   4.965097 106.202.133.241 -> 96.17.182.40 TCP 68 34988 > http [ACK] Seq=1125 Ack=8209 Win=31976 Len=0 TSval=939574 TSecr=3912059450
182   4.965152 96.17.182.40 -> 106.202.133.241 TCP 1436 [TCP segment of a reassembled PDU]
183   4.965220 106.202.133.241 -> 96.17.182.40 TCP 68 34988 > http [ACK] Seq=1125 Ack=9577 Win=34872 Len=0 TSval=939574 TSecr=3912059450
184   4.965243 96.17.182.40 -> 106.202.133.241 TCP 1436 [TCP segment of a reassembled PDU]
185   4.965278 96.17.182.40 -> 106.202.133.241 HTTP 247 HTTP/1.1 200 OK  (JPEG JFIF image)
186   4.965299 96.17.182.40 -> 106.202.133.241 TCP 68 http > 34989 [ACK] Seq=1 Ack=1125 Win=16728 Len=0 TSval=3912059508 TSecr=939420
187   4.965393 96.17.182.40 -> 106.202.133.241 TCP 1436 [TCP segment of a reassembled PDU]
188   4.965428 106.202.133.241 -> 96.17.182.40 TCP 68 34988 > http [ACK] Seq=1125 Ack=10945 Win=37768 Len=0 TSval=939574 TSecr=3912059450
189   4.965449 106.202.133.241 -> 96.17.182.40 TCP 68 34989 > http [ACK] Seq=1125 Ack=1369 Win=17496 Len=0 TSval=939574 TSecr=3912059508
190   4.965463 96.17.182.40 -> 106.202.133.241 TCP 1436 [TCP segment of a reassembled PDU]
191   4.965472 106.202.133.241 -> 96.17.182.40 TCP 68 34988 > http [ACK] Seq=1125 Ack=11124 Win=40504 Len=0 TSval=939574 TSecr=3912059450
192   4.965509 106.202.133.241 -> 96.17.182.40 TCP 68 34989 > http [ACK] Seq=1125 Ack=2737 Win=20392 Len=0 TSval=939574 TSecr=3912059508
193   4.965525 96.17.182.40 -> 106.202.133.241 TCP 1436 [TCP segment of a reassembled PDU]
194   4.965599 106.202.133.241 -> 96.17.182.40 TCP 68 34989 > http [ACK] Seq=1125 Ack=4105 Win=23288 Len=0 TSval=939574 TSecr=3912059508
195   4.965611 96.17.182.40 -> 106.202.133.241 TCP 1436 [TCP segment of a reassembled PDU]
196   4.965666 106.202.133.241 -> 96.17.182.40 TCP 68 34989 > http [ACK] Seq=1125 Ack=5473 Win=26184 Len=0 TSval=939574 TSecr=3912059508
197   5.056282 96.17.182.40 -> 106.202.133.241 TCP 1436 [TCP segment of a reassembled PDU]
198   5.056523 106.202.133.241 -> 96.17.182.40 TCP 68 34989 > http [ACK] Seq=1125 Ack=6841 Win=29080 Len=0 TSval=939592 TSecr=3912059508
199   5.136281 96.17.182.40 -> 106.202.133.241 TCP 1436 [TCP segment of a reassembled PDU]
200   5.136446 106.202.133.241 -> 96.17.182.40 TCP 68 34989 > http [ACK] Seq=1125 Ack=8209 Win=31976 Len=0 TSval=939608 TSecr=3912059508
201   5.173960 106.202.133.241 -> 223.165.25.18 TCP 68 42932 > http [FIN, ACK] Seq=463 Ack=514 Win=15672 Len=0 TSval=939616 TSecr=906061542
202   5.184439 96.17.182.40 -> 106.202.133.241 TCP 1436 [TCP segment of a reassembled PDU]
203   5.184753 106.202.133.241 -> 96.17.182.40 TCP 68 34989 > http [ACK] Seq=1125 Ack=9577 Win=34872 Len=0 TSval=939618 TSecr=3912059508
204   5.218527 96.17.182.40 -> 106.202.133.241 TCP 1436 [TCP segment of a reassembled PDU]
205   5.218812 106.202.133.241 -> 96.17.182.40 TCP 68 34989 > http [ACK] Seq=1125 Ack=10945 Win=37768 Len=0 TSval=939625 TSecr=3912059508
206   5.276599 96.17.182.40 -> 106.202.133.241 TCP 1436 [TCP segment of a reassembled PDU]
207   5.276904 106.202.133.241 -> 96.17.182.40 TCP 68 34989 > http [ACK] Seq=1125 Ack=12313 Win=40664 Len=0 TSval=939636 TSecr=3912059508
208   5.277002 96.17.182.40 -> 106.202.133.241 TCP 1436 [TCP segment of a reassembled PDU]
209   5.277169 106.202.133.241 -> 96.17.182.40 TCP 68 34989 > http [ACK] Seq=1125 Ack=13681 Win=43560 Len=0 TSval=939636 TSecr=3912059508
210   5.281425 96.17.182.40 -> 106.202.133.241 TCP 68 http > 34990 [ACK] Seq=1 Ack=1125 Win=16728 Len=0 TSval=3912059571 TSecr=939420
211   5.316389 96.17.182.40 -> 106.202.133.241 TCP 1436 [TCP segment of a reassembled PDU]
212   5.316621 106.202.133.241 -> 96.17.182.40 TCP 68 34990 > http [ACK] Seq=1125 Ack=1369 Win=17496 Len=0 TSval=939644 TSecr=3912059572
213   5.328252 96.17.182.40 -> 106.202.133.241 TCP 1436 [TCP segment of a reassembled PDU]
214   5.328433 106.202.133.241 -> 96.17.182.40 TCP 68 34990 > http [ACK] Seq=1125 Ack=2737 Win=20392 Len=0 TSval=939647 TSecr=3912059572
215   5.511599 96.17.182.40 -> 106.202.133.241 TCP 1436 [TCP segment of a reassembled PDU]
216   5.511778 106.202.133.241 -> 96.17.182.40 TCP 68 34990 > http [ACK] Seq=1125 Ack=4105 Win=23288 Len=0 TSval=939683 TSecr=3912059572
217   5.571745 96.17.182.40 -> 106.202.133.241 TCP 1436 [TCP segment of a reassembled PDU]
218   5.572051 106.202.133.241 -> 96.17.182.40 TCP 68 34990 > http [ACK] Seq=1125 Ack=5473 Win=26184 Len=0 TSval=939695 TSecr=3912059572
219   5.601739 96.17.182.40 -> 106.202.133.241 TCP 1436 [TCP segment of a reassembled PDU]
220   5.602032 106.202.133.241 -> 96.17.182.40 TCP 68 34990 > http [ACK] Seq=1125 Ack=6841 Win=29080 Len=0 TSval=939701 TSecr=3912059572
221   5.613209 96.17.182.40 -> 106.202.133.241 TCP 1436 [TCP segment of a reassembled PDU]
222   5.613472 106.202.133.241 -> 96.17.182.40 TCP 68 34990 > http [ACK] Seq=1125 Ack=8209 Win=31976 Len=0 TSval=939704 TSecr=3912059572
223   5.613774 96.17.182.40 -> 106.202.133.241 TCP 1436 [TCP segment of a reassembled PDU]
224   5.614041 106.202.133.241 -> 96.17.182.40 TCP 68 34990 > http [ACK] Seq=1125 Ack=9577 Win=34872 Len=0 TSval=939704 TSecr=3912059572
225   5.615118 96.17.182.40 -> 106.202.133.241 TCP 1436 [TCP segment of a reassembled PDU]
226   5.615438 106.202.133.241 -> 96.17.182.40 TCP 68 34990 > http [ACK] Seq=1125 Ack=10945 Win=37768 Len=0 TSval=939704 TSecr=3912059572
227   5.615701 96.17.182.40 -> 106.202.133.241 TCP 1436 [TCP segment of a reassembled PDU]
228   5.615978 106.202.133.241 -> 96.17.182.40 TCP 68 34990 > http [ACK] Seq=1125 Ack=12313 Win=40664 Len=0 TSval=939704 TSecr=3912059572
229   5.616047 96.17.182.40 -> 106.202.133.241 TCP 1436 [TCP segment of a reassembled PDU]
230   5.616208 106.202.133.241 -> 96.17.182.40 TCP 68 34990 > http [ACK] Seq=1125 Ack=13681 Win=43560 Len=0 TSval=939704 TSecr=3912059572
231   5.616243 96.17.182.40 -> 106.202.133.241 TCP 68 http > 34991 [ACK] Seq=1 Ack=1125 Win=16728 Len=0 TSval=3912059632 TSecr=939420
232   5.616408 96.17.182.40 -> 106.202.133.241 TCP 1436 [TCP segment of a reassembled PDU]
233   5.616581 106.202.133.241 -> 96.17.182.40 TCP 68 34991 > http [ACK] Seq=1125 Ack=1369 Win=17496 Len=0 TSval=939704 TSecr=3912059632
234   5.616624 96.17.182.40 -> 106.202.133.241 TCP 1436 [TCP segment of a reassembled PDU]
235   5.616795 106.202.133.241 -> 96.17.182.40 TCP 68 34991 > http [ACK] Seq=1125 Ack=2737 Win=20392 Len=0 TSval=939704 TSecr=3912059632
236   5.616832 96.17.182.40 -> 106.202.133.241 TCP 1436 [TCP segment of a reassembled PDU]
237   5.616997 106.202.133.241 -> 96.17.182.40 TCP 68 34991 > http [ACK] Seq=1125 Ack=4105 Win=23288 Len=0 TSval=939704 TSecr=3912059632
238   5.621644 96.17.182.40 -> 106.202.133.241 TCP 1436 [TCP segment of a reassembled PDU]
239   5.621969 106.202.133.241 -> 96.17.182.40 TCP 68 34991 > http [ACK] Seq=1125 Ack=5473 Win=26184 Len=0 TSval=939705 TSecr=3912059632
240   5.632091 96.17.182.40 -> 106.202.133.241 TCP 1436 [TCP segment of a reassembled PDU]
241   5.632376 106.202.133.241 -> 96.17.182.40 TCP 68 34991 > http [ACK] Seq=1125 Ack=6841 Win=29080 Len=0 TSval=939707 TSecr=3912059632
242   5.671491 96.17.182.40 -> 106.202.133.241 TCP 1436 [TCP segment of a reassembled PDU]
243   5.671652 106.202.133.241 -> 96.17.182.40 TCP 68 34991 > http [ACK] Seq=1125 Ack=8209 Win=31976 Len=0 TSval=939715 TSecr=3912059632
244   5.691360 96.17.182.40 -> 106.202.133.241 TCP 1436 [TCP segment of a reassembled PDU]
245   5.691508 106.202.133.241 -> 96.17.182.40 TCP 68 34991 > http [ACK] Seq=1125 Ack=9577 Win=34872 Len=0 TSval=939719 TSecr=3912059632
246   5.721733 96.17.182.40 -> 106.202.133.241 TCP 1436 [TCP segment of a reassembled PDU]
247   5.721999 106.202.133.241 -> 96.17.182.40 TCP 68 34991 > http [ACK] Seq=1125 Ack=10945 Win=37768 Len=0 TSval=939725 TSecr=3912059632
248   5.741675 96.17.182.40 -> 106.202.133.241 TCP 1436 [TCP segment of a reassembled PDU]
249   5.742031 106.202.133.241 -> 96.17.182.40 TCP 68 34991 > http [ACK] Seq=1125 Ack=12313 Win=40664 Len=0 TSval=939729 TSecr=3912059632
250   5.771769 96.17.182.40 -> 106.202.133.241 TCP 1436 [TCP segment of a reassembled PDU]
251   5.771988 106.202.133.241 -> 96.17.182.40 TCP 68 34991 > http [ACK] Seq=1125 Ack=13681 Win=43560 Len=0 TSval=939735 TSecr=3912059632
252   5.772968 96.17.182.40 -> 106.202.133.241 TCP 68 http > 34992 [ACK] Seq=1 Ack=1125 Win=16728 Len=0 TSval=3912059716 TSecr=939420
253   5.787559 106.202.133.241 -> 223.165.25.18 TCP 68 42932 > http [FIN, ACK] Seq=463 Ack=514 Win=15672 Len=0 TSval=939739 TSecr=906061542
254   5.791346 96.17.182.40 -> 106.202.133.241 TCP 1436 [TCP segment of a reassembled PDU]
255   5.791447 106.202.133.241 -> 96.17.182.40 TCP 68 34992 > http [ACK] Seq=1125 Ack=1369 Win=17496 Len=0 TSval=939739 TSecr=3912059716
256   5.813032 96.17.182.40 -> 106.202.133.241 TCP 1436 [TCP segment of a reassembled PDU]
257   5.813229 106.202.133.241 -> 96.17.182.40 TCP 68 34992 > http [ACK] Seq=1125 Ack=2737 Win=20392 Len=0 TSval=939744 TSecr=3912059716
258   5.832119 96.17.182.40 -> 106.202.133.241 TCP 1436 [TCP segment of a reassembled PDU]
259   5.832265 106.202.133.241 -> 96.17.182.40 TCP 68 34992 > http [ACK] Seq=1125 Ack=4105 Win=23288 Len=0 TSval=939747 TSecr=3912059716
260   5.862008 96.17.182.40 -> 106.202.133.241 TCP 1436 [TCP segment of a reassembled PDU]
261   5.862332 106.202.133.241 -> 96.17.182.40 TCP 68 34992 > http [ACK] Seq=1125 Ack=5473 Win=26184 Len=0 TSval=939753 TSecr=3912059716
262   5.881599 96.17.182.40 -> 106.202.133.241 TCP 1436 [TCP segment of a reassembled PDU]
263   5.881870 106.202.133.241 -> 96.17.182.40 TCP 68 34992 > http [ACK] Seq=1125 Ack=6841 Win=29080 Len=0 TSval=939757 TSecr=3912059716
264   5.911739 96.17.182.40 -> 106.202.133.241 TCP 1436 [TCP segment of a reassembled PDU]
265   5.912030 106.202.133.241 -> 96.17.182.40 TCP 68 34992 > http [ACK] Seq=1125 Ack=8209 Win=31976 Len=0 TSval=939763 TSecr=3912059716
266   5.932243 96.17.182.40 -> 106.202.133.241 TCP 1436 [TCP segment of a reassembled PDU]
267   5.932726 106.202.133.241 -> 96.17.182.40 TCP 68 34992 > http [ACK] Seq=1125 Ack=9577 Win=34872 Len=0 TSval=939768 TSecr=3912059716
268   5.961518 96.17.182.40 -> 106.202.133.241 TCP 1436 [TCP segment of a reassembled PDU]
269   5.961743 106.202.133.241 -> 96.17.182.40 TCP 68 34992 > http [ACK] Seq=1125 Ack=10945 Win=37768 Len=0 TSval=939773 TSecr=3912059716
270   5.991480 96.17.182.40 -> 106.202.133.241 TCP 1436 [TCP segment of a reassembled PDU]
271   5.991640 106.202.133.241 -> 96.17.182.40 TCP 68 34992 > http [ACK] Seq=1125 Ack=12313 Win=40664 Len=0 TSval=939779 TSecr=3912059716
272   6.001473 96.17.182.40 -> 106.202.133.241 TCP 1436 [TCP segment of a reassembled PDU]
273   6.001590 106.202.133.241 -> 96.17.182.40 TCP 68 34992 > http [ACK] Seq=1125 Ack=13681 Win=43560 Len=0 TSval=939781 TSecr=3912059716
274   6.001705 96.17.182.40 -> 106.202.133.241 TCP 68 http > 34993 [ACK] Seq=1 Ack=1125 Win=16728 Len=0 TSval=3912059776 TSecr=939421
275   6.041517 96.17.182.40 -> 106.202.133.241 TCP 1436 [TCP segment of a reassembled PDU]
276   6.041680 106.202.133.241 -> 96.17.182.40 TCP 68 34993 > http [ACK] Seq=1125 Ack=1369 Win=17496 Len=0 TSval=939789 TSecr=3912059776
277   6.061700 96.17.182.40 -> 106.202.133.241 TCP 1436 [TCP segment of a reassembled PDU]
278   6.062082 106.202.133.241 -> 96.17.182.40 TCP 68 34993 > http [ACK] Seq=1125 Ack=2737 Win=20392 Len=0 TSval=939793 TSecr=3912059776
279   6.082190 96.17.182.40 -> 106.202.133.241 TCP 1436 [TCP segment of a reassembled PDU]
280   6.082701 106.202.133.241 -> 96.17.182.40 TCP 68 34993 > http [ACK] Seq=1125 Ack=4105 Win=23288 Len=0 TSval=939798 TSecr=3912059776
281   6.101517 96.17.182.40 -> 106.202.133.241 TCP 1436 [TCP segment of a reassembled PDU]
282   6.101709 106.202.133.241 -> 96.17.182.40 TCP 68 34993 > http [ACK] Seq=1125 Ack=5473 Win=26184 Len=0 TSval=939801 TSecr=3912059776
283   6.131751 96.17.182.40 -> 106.202.133.241 TCP 1436 [TCP segment of a reassembled PDU]
284   6.131890 106.202.133.241 -> 96.17.182.40 TCP 68 34993 > http [ACK] Seq=1125 Ack=6841 Win=29080 Len=0 TSval=939807 TSecr=3912059776
285   6.161740 96.17.182.40 -> 106.202.133.241 TCP 1436 [TCP segment of a reassembled PDU]
286   6.162070 106.202.133.241 -> 96.17.182.40 TCP 68 34993 > http [ACK] Seq=1125 Ack=8209 Win=31976 Len=0 TSval=939813 TSecr=3912059776
287   6.182001 96.17.182.40 -> 106.202.133.241 TCP 1436 [TCP segment of a reassembled PDU]
288   6.182304 106.202.133.241 -> 96.17.182.40 TCP 68 34993 > http [ACK] Seq=1125 Ack=9577 Win=34872 Len=0 TSval=939817 TSecr=3912059776
289   6.201594 96.17.182.40 -> 106.202.133.241 TCP 1436 [TCP segment of a reassembled PDU]
290   6.201862 106.202.133.241 -> 96.17.182.40 TCP 68 34993 > http [ACK] Seq=1125 Ack=10945 Win=37768 Len=0 TSval=939821 TSecr=3912059776
291   6.221703 96.17.182.40 -> 106.202.133.241 TCP 1436 [TCP segment of a reassembled PDU]
292   6.221943 106.202.133.241 -> 96.17.182.40 TCP 68 34993 > http [ACK] Seq=1125 Ack=12313 Win=40664 Len=0 TSval=939825 TSecr=3912059776
293   6.253894 96.17.182.40 -> 106.202.133.241 TCP 1436 [TCP segment of a reassembled PDU]
294   6.254212 106.202.133.241 -> 96.17.182.40 TCP 68 34993 > http [ACK] Seq=1125 Ack=13681 Win=43560 Len=0 TSval=939832 TSecr=3912059776
295   6.254525 96.17.182.40 -> 106.202.133.241 TCP 68 http > 34994 [ACK] Seq=1 Ack=1125 Win=16728 Len=0 TSval=3912059862 TSecr=939421
296   6.271741 96.17.182.40 -> 106.202.133.241 TCP 1436 [TCP segment of a reassembled PDU]
297   6.271985 106.202.133.241 -> 96.17.182.40 TCP 68 34994 > http [ACK] Seq=1125 Ack=1369 Win=17496 Len=0 TSval=939835 TSecr=3912059862
298   6.307780 96.17.182.40 -> 106.202.133.241 TCP 1436 [TCP segment of a reassembled PDU]
299   6.308136 106.202.133.241 -> 96.17.182.40 TCP 68 34994 > http [ACK] Seq=1125 Ack=2737 Win=20392 Len=0 TSval=939843 TSecr=3912059862
300   6.333735 96.17.182.40 -> 106.202.133.241 TCP 1436 [TCP segment of a reassembled PDU]
301   6.334004 106.202.133.241 -> 96.17.182.40 TCP 68 34994 > http [ACK] Seq=1125 Ack=4105 Win=23288 Len=0 TSval=939848 TSecr=3912059862
302   6.337676 106.202.133.241 -> 223.165.25.44 HTTP 670 [TCP Retransmission] GET /ga.jsp?utmac=MO-12812017-1&utmn=307973881&utmr=-&utmp=%2F&guid=ON HTTP/1.1 
303   6.341567 96.17.182.40 -> 106.202.133.241 TCP 1436 [TCP segment of a reassembled PDU]
304   6.341798 106.202.133.241 -> 96.17.182.40 TCP 68 34994 > http [ACK] Seq=1125 Ack=5473 Win=26184 Len=0 TSval=939849 TSecr=3912059862
305   6.361769 96.17.182.40 -> 106.202.133.241 TCP 1436 [TCP segment of a reassembled PDU]
306   6.362122 106.202.133.241 -> 96.17.182.40 TCP 68 34994 > http [ACK] Seq=1125 Ack=6841 Win=29080 Len=0 TSval=939853 TSecr=3912059862
307   6.401622 96.17.182.40 -> 106.202.133.241 TCP 1436 [TCP segment of a reassembled PDU]
308   6.401923 106.202.133.241 -> 96.17.182.40 TCP 68 34994 > http [ACK] Seq=1125 Ack=8209 Win=31976 Len=0 TSval=939861 TSecr=3912059862
309   6.411484 96.17.182.40 -> 106.202.133.241 TCP 1436 [TCP segment of a reassembled PDU]
310   6.411812 106.202.133.241 -> 96.17.182.40 TCP 68 34994 > http [ACK] Seq=1125 Ack=9577 Win=34872 Len=0 TSval=939863 TSecr=3912059862
311   6.453569 96.17.182.40 -> 106.202.133.241 TCP 1436 [TCP segment of a reassembled PDU]
312   6.453827 106.202.133.241 -> 96.17.182.40 TCP 68 34994 > http [ACK] Seq=1125 Ack=10945 Win=37768 Len=0 TSval=939872 TSecr=3912059862
313   6.471277 96.17.182.40 -> 106.202.133.241 TCP 1436 [TCP segment of a reassembled PDU]
314   6.471379 106.202.133.241 -> 96.17.182.40 TCP 68 34994 > http [ACK] Seq=1125 Ack=12313 Win=40664 Len=0 TSval=939875 TSecr=3912059862
315   6.481409 96.17.182.40 -> 106.202.133.241 TCP 1436 [TCP segment of a reassembled PDU]
316   6.481504 106.202.133.241 -> 96.17.182.40 TCP 68 34994 > http [ACK] Seq=1125 Ack=13681 Win=43560 Len=0 TSval=939877 TSecr=3912059862
317   6.481535 223.165.25.44 -> 106.202.133.241 TCP 76 http > 51098 [SYN, ACK] Seq=0 Ack=1 Win=5792 Len=0 MSS=1380 SACK_PERM=1 TSval=884534208 TSecr=939424 WS=128
318   6.481630 106.202.133.241 -> 223.165.25.44 TCP 68 51098 > http [ACK] Seq=1 Ack=1 Win=14600 Len=0 TSval=939877 TSecr=884534208
319   6.481645 122.248.235.235 -> 106.202.133.241 TCP 76 http > 58145 [SYN, ACK] Seq=0 Ack=1 Win=14480 Len=0 MSS=1380 SACK_PERM=1 TSval=171809186 TSecr=939423 WS=256
320   6.481715 106.202.133.241 -> 122.248.235.235 TCP 68 58145 > http [ACK] Seq=1 Ack=1 Win=14600 Len=0 TSval=939877 TSecr=171809186
321   6.491168 223.165.25.44 -> 106.202.133.241 TCP 68 http > 51096 [ACK] Seq=1 Ack=603 Win=7040 Len=0 TSval=884534243 TSecr=939434
322   6.491251 122.248.235.235 -> 106.202.133.241 TCP 68 http > 58136 [ACK] Seq=1 Ack=558 Win=15616 Len=0 TSval=171809209 TSecr=939434
323   6.501771 223.165.25.44 -> 106.202.133.241 TCP 727 [TCP segment of a reassembled PDU]
324   6.501992 106.202.133.241 -> 223.165.25.44 TCP 68 51096 > http [ACK] Seq=603 Ack=660 Win=15918 Len=0 TSval=939881 TSecr=884534351
325   6.502186 223.165.25.44 -> 106.202.133.241 HTTP 73 HTTP/1.1 200 OK  (GIF89a)
326   6.502375 106.202.133.241 -> 223.165.25.44 TCP 68 51096 > http [ACK] Seq=603 Ack=665 Win=15918 Len=0 TSval=939881 TSecr=884534352
327   6.541800 122.248.235.235 -> 106.202.133.241 TCP 1436 [TCP segment of a reassembled PDU]
328   6.542061 106.202.133.241 -> 122.248.235.235 TCP 68 58136 > http [ACK] Seq=558 Ack=1369 Win=17496 Len=0 TSval=939889 TSecr=171809216
329   6.551376 122.248.235.235 -> 106.202.133.241 HTTP 796 HTTP/1.1 200 OK  (text/html)
330   6.551619 106.202.133.241 -> 122.248.235.235 TCP 68 58136 > http [ACK] Seq=558 Ack=2097 Win=20232 Len=0 TSval=939891 TSecr=171809216
331   6.572182 96.17.182.40 -> 106.202.133.241 TCP 1436 [TCP segment of a reassembled PDU]
